4755276018.jpg| 1| Two women , one wearing a red , white and blue bikini pose for a picture on a city 's street .;
4755276018.jpg| 2| Two scantily clad women danced at the amusement of onlookers .;
4755276018.jpg| 3| Two women pose standing on the sidewalk pose for a picture .;
4755276018.jpg| 4| They are dancing in the streets .;
4756974733.jpg| 0| A man wearing a long-sleeved white shirt and pink necktie , and a woman wearing a white blouse and black skirt walk next to a cinder block wall .;
4756974733.jpg| 1| A woman and a man both dressed in black and white are walking down a side street next to a concrete wall topped with barbed wire .;
4756974733.jpg| 2| A woman and Man walking in white shirts and black bottoms on their way to work;
4756974733.jpg| 3| A man and a woman in suits are walking in front of a wall .;
4756974733.jpg| 4| People walking past a wall topped with razor wire .;
4758348295.jpg| 0| A man with his suit jacket thrown over his shoulder walks past a wall decorated with graffiti art .;
4758348295.jpg| 1| A man carries his jacket as he walks by some ornate graffiti on a wall .;
4758348295.jpg| 2| This man is walking past a wall that has art on it .;
4758348295.jpg| 3| A man with a coat is walking in front of a mural .;
4758348295.jpg| 4| Elderly man walks down a graffiti filled street .;
4758483073.jpg| 0| A man attempts to start a flying model of a bi-plane with British air force rondel markings .;
4758483073.jpg| 1| a man with a black vest holding a model airplane;
4758483073.jpg| 2| A man tests model airplanes in an open field .;
4758483073.jpg| 3| A man holding a remote controlled airplane .;
4758483073.jpg| 4| A man packs up his toy airplane .;
4758626595.jpg| 0| The three older men brought their model planes to the empty field and prepared to fly them .;
4758626595.jpg| 1| Three older gentleman getting ready to fly remote control airplanes .;
4758626595.jpg| 2| Three elderly men resolve issues on their mechanical fly-plane .;
4758626595.jpg| 3| Several men are tinkering with radio controlled items .;
4758626595.jpg| 4| Three men in a field with model airplanes .;
4763795859.jpg| 0| A girl in a green striped bikini sunbathing on a brown blanket on a concrete embankment .;
4763795859.jpg| 1| A woman is sunbathing on a concrete ledge with a field of grass behind her .;
4763795859.jpg| 2| A dark-haired woman in a striped bikini sunbathes on a blanket .;
4763795859.jpg| 3| A woman outside sun-bathing on a blanket in a bikini .;
4763795859.jpg| 4| A woman is sunbathing on the ground .;
4768505553.jpg| 0| A dark figure on a surfboard is riding the waves of some aquamarine colored water .;
4768505553.jpg| 1| A surfer is excellently riding a big wave in the sunlight .;
4768505553.jpg| 2| A man surfs a large wave in a beautiful oceanic seascape .;
4768505553.jpg| 3| A man in a dark wetsuit surfing in a blue watered ocean .;
4768505553.jpg| 4| A person is riding a surfboard on a wave .;
4770745669.jpg| 1| A man wearing shorts is standing in front of the door of a multi story building .;
4770745669.jpg| 3| A man with a black shirt and blue shorts stands in the doorway of a storefront .;
4770745669.jpg| 4| A man in a black polo shirt stands in the doorway of a Gelateria .;
4771355927.jpg| 0| There is a man in shorts wading out waist deep in the water with nothing else in site .;
4771355927.jpg| 1| A man is standing with no shirt on is standing in waist-deep water .;
4771355927.jpg| 2| A shirtless man wades in smooth blue water .;
4771355927.jpg| 3| A topless man wades through hip deep water .;
4771355927.jpg| 4| Man in light trunks wading in water .;
477429473.jpg| 0| Two men dressed in similar white uniforms are wrestling on what appears to be a gym mat .;
477429473.jpg| 1| Two people in white martial arts suits are shown as one pins the other to the ground .;
477429473.jpg| 2| Two men in martial arts garb grapple each other .;
477429473.jpg| 3| One of the wrestlers has pinned his opponent .;
477429473.jpg| 4| two players playing karate in white dresses .;
4775597702.jpg| 0| A man with a humongous abdominal section is sitting on top of a bench near a car .;
4775597702.jpg| 1| A white bearded man sitting on a bench watching boats .;
4775597702.jpg| 2| Bearded man sitting on a bench next to a boat .;
4775597702.jpg| 3| An old , fat man is sitting on a bench .;
4775597702.jpg| 4| A man sitting at a boating dock .;
4778036926.jpg| 0| A blond girl about 11 with a purple shirt and checkered green and white and black knee high shorts playing a game that requires her to roll an object up and down on a string .;
4778036926.jpg| 1| A white girl wearing a purple shirt and plaid shorts is playing with a chinese yo-yo .;
4778036926.jpg| 2| A blond girl in a purple shirt and plaid shorts playing with a string toy .;
4778036926.jpg| 3| A girl in a purple t-shirt and plaid shorts plays with a yo-yo type toy .;
4778036926.jpg| 4| A girl plays with an old fashioned toy outside .;
4778593226.jpg| 0| Two middle-aged men , one of which is holding a camera , have a conversation on the sidewalk .;
4778593226.jpg| 1| A man with a camera is engaging another man in conversation on a street .;
4778593226.jpg| 2| two men standing on the sidewalk in front of a silver van .;
4778593226.jpg| 3| Two men waiting and talking on a city street .;
4778593226.jpg| 4| Two men are speaking on a sidewalk .;
4779413689.jpg| 0| A man in a pink shirt , sitting on the edge of the telephone booth with his back to us .;
4779413689.jpg| 1| A man in a pink shirt and shorts , sits in a telephone booth making a telephone call .;
4779413689.jpg| 2| man crammed into a phone booth wearing a pink shirt .;
4779413689.jpg| 3| A person wearing a red shirt using a pay phone .;
4779413689.jpg| 4| Person in pink shirt using a public phone .;
4781897636.jpg| 0| A woman in bright red lipstick and a black and white polka-dot bare-shouldered top strolls with other pedestrians past the booths in an open-air market .;
4781897636.jpg| 1| people are standing around staring at something wearing different color of clothing .;
4781897636.jpg| 2| A woman with a red-hair tie and black polka-dot top holding a bottle of water .;
4781897636.jpg| 3| A woman looking somewhat angry holding a water bottle .;
4781897636.jpg| 4| Onlookers view an activity in awe .;
4795241726.jpg| 0| A truck is on the side of the road with its hood up and a man with blue pants is underneath the front of the truck .;
4795241726.jpg| 1| A man in overalls and gloves is laying underneath a truck .;
4795241726.jpg| 2| A mechanic below a truck conducting repairs .;
4795241726.jpg| 3| A truck-driver is working on his truck .;
4795241726.jpg| 4| A person is working on their truck .;
4798302385.jpg| 0| A woman in a purple top and black shorts and a woman in a gray top and blue shorts , wearing brown and black hats respectively , walk on a street past a woman in a black top and a brown skirt holding a black bag .;
4798302385.jpg| 1| Two women in skirts and baseball caps pass another woman in a skirt on the street .;
4798302385.jpg| 2| Two women in athletic gear walking down a city street .;
4798302385.jpg| 3| Three women are walking on a street .;
4798302385.jpg| 4| Young ladies crossing a street .;
480074435.jpg| 0| A man wearing a brown shirt and blue jeans is standing alone in a room holding a guitar .;
480074435.jpg| 1| A man with blue jeans and glasses stands playing a guitar in a room with two chairs .;
480074435.jpg| 2| a man stands with a guitar and music stand in an empty room .;
480074435.jpg| 3| A man wearing glasses plays a guitar behind a music stand .;
480074435.jpg| 4| A gentleman is playing an acoustic guitar .;
4803926155.jpg| 0| A store on the side of the road that contains many baskets filled with goods .;
4803926155.jpg| 1| A woman in a tan dress is tending to her wares in the market .;
4803926155.jpg| 2| A person shopping at an open air market in another country .;
4803926155.jpg| 3| A person is standing in the midst of many baskets of food .;
4803926155.jpg| 4| A robed woman stands in a village market .;
4808132639.jpg| 0| A drummer playing the drums , behind him is a blue wall with white writing .;
4808132639.jpg| 1| A man wearing a gray shirt and pink wristband plays the drums .;
4808132639.jpg| 2| A young man with long hair sits at a drum set on stage .;
4808132639.jpg| 3| Long-haired drummer lays down the beat .;
4808132639.jpg| 4| A long-haired guy playing the drums .;
481054596.jpg| 0| The man in the red shirt is taking a photo of the couple that is hugging on the sidewalk .;
481054596.jpg| 1| a couple hugging with other people standing around in front of some buildings;
481054596.jpg| 2| The man in the red shirt is taking a picture of the two people hugging .;
481054596.jpg| 3| A man and a woman hug on a street .;
481054596.jpg| 4| two people share a hug .;
4810830329.jpg| 0| Two young women holding umbrellas are waiting on the edge of a street in a passenger pickup area .;
4810830329.jpg| 1| Two women with umbrellas walk between two cars as they cross the street .;
4810830329.jpg| 2| Two women cross the street with umbrellas while it is raining .;
4810830329.jpg| 3| Two women are walking across a street carrying umbrellas .;
4810830329.jpg| 4| Two women with umbrellas are trying to cross a busy street;
4813023306.jpg| 0| There are two main women in this photo , one is fixing her dress strap on her should and the other one is looking at her while is pushes her baby carriage .;
4813023306.jpg| 1| A view of people on a sidewalk , with a woman in a leopard dress and another woman pushing a stroller with a child in the foreground .;
4813023306.jpg| 2| A woman stands with her baby sleeping in a stroller in a sea of people .;
4813023306.jpg| 3| A crowd of people waiting along the side of a building .;
4813023306.jpg| 4| A group of people and a baby .;
4814933116.jpg| 0| A woman lounges on a towel in front of people enjoying the blue water .;
4814933116.jpg| 1| A woman in a two piece swimsuit is on the beach looking at her foot .;
4814933116.jpg| 2| A woman in a purple bikini sunbathes on a towel beside water .;
4814933116.jpg| 3| a girl on a swimsuit stretching her leg next to the beach;
4814933116.jpg| 4| A young women sunbathes at the sea .;
481632457.jpg| 0| A big tri-colored and a smaller puppy with light blue eyes are playing together .;
481632457.jpg| 1| An adult Australian Shepherd follows behind a running Australian Shepherd puppy .;
481632457.jpg| 2| A small black and white dog is followed by a larger dog in a grassy yard .;
481632457.jpg| 3| A puppy with blue eyes runs , an older dog with blue eyes stands behind .;
481632457.jpg| 4| The two dogs are outside .;
4821884870.jpg| 0| A girl in a black jacket with crossed arms holds a bag on the street in the rain .;
4821884870.jpg| 1| Woman in Jacket with hood up walks alone down crowded street .;
4821884870.jpg| 2| A girl in a dark jacket standing in the rain .;
4821884870.jpg| 3| Girl bundled up in jacket against the cold .;
4821884870.jpg| 4| A child standing and staring at something .;
4821989284.jpg| 0| A man is on stage with no shirt on grabbing a pool at what looks like a tv sporting event .;
4821989284.jpg| 1| a man with no shirt holds a light pole as he stands on part of the stage .;
4821989284.jpg| 2| A man on a state sets up while people look on .;
4821989284.jpg| 3| Band on stage and people watching the screen .;
4821989284.jpg| 4| Man stands on equipment at concert .;
4823839290.jpg| 0| A man wearing a jacket and blue jeans sits on a railing as he looks out into a body of water alone .;
4823839290.jpg| 1| A man in a black leather jacket sitting looking at the city beyond .;
4823839290.jpg| 2| A man sitting on a metal fence overlooking the water and skyline .;
4823839290.jpg| 3| A man in a leather jacket is sitting on a fence by the beach .;
4823839290.jpg| 4| Man look at water sitting on a bar .;
4825995199.jpg| 0| A man wearing a striped shirt carried a white scroll as he walked down the street .;
4825995199.jpg| 1| A crowd of men sit smoking hookah in an unidentified Arabic-speaking country .;
4825995199.jpg| 2| People passing the time in a city in a middle eastern country .;
4825995199.jpg| 3| Men in blue robes with hookahs sitting on the street .;
4825995199.jpg| 4| People are relaxing on the side of the road .;
4829871518.jpg| 0| An older black women wearing a straw hat and striped dress sits on periwinkle bench whilst grasping her cranberry-colored coat .;
4829871518.jpg| 1| A woman is sitting on a bench , holding her jacket , looking in the distance .;
4829871518.jpg| 2| An African American woman wearing a hat sits waiting on a purple bench .;
4829871518.jpg| 3| A black woman in a striped dress sitting on a blue bench .;
4829871518.jpg| 4| Colored woman in straw hat sitting on a bench outside .;
4833918883.jpg| 0| A man stands on the sidewalk near a lamp post as well as a pillar forming part of an edifice .;
4833918883.jpg| 1| A lone man leans on a pole in front of a large building on a deserted street .;
4833918883.jpg| 2| A man in a black shirt and jeans standing under a bridge in the city .;
4833918883.jpg| 3| A person stands under a city light pole on a sidewalk at night .;
4833918883.jpg| 4| Man in sweater standing alone under an overpass .;
4836470397.jpg| 0| A little boy watched his father swinging in a blue hammock while a US AID canvas was used for a temporary shelter for them .;
4836470397.jpg| 1| A man and child are together with a blue net in front of them .;
4836470397.jpg| 2| Shirtless man and child sitting in a blue hammock .;
4836470397.jpg| 3| A small child and old man share a blue hammock .;
4836470397.jpg| 4| A man and a child sitting in a blue net .;
4845740339.jpg| 0| A man in a white shirt and motorcycle helmet is walking among a crowd of people in what appears to be a busy place .;
4845740339.jpg| 1| A man wearing black pants , white shirt , and a white helmet is walking through a crowd .;
4845740339.jpg| 2| A man wearing a helmet is walking down a hallway .;
4845740339.jpg| 3| A man wearing a white helmet in a crowd .;
4845740339.jpg| 4| A man in a white helmet is walking .;
4850651669.jpg| 0| A young girl with a fake mustache and face paint is riding on rollerskates while talking on her cellphone;
4850651669.jpg| 1| A person is rollerskating outside wear rainbow cohered shorts , a pink bikini top and a mustache .;
4850651669.jpg| 2| A girl is rollerskating down a street while talking on a cellphone .;
4850651669.jpg| 3| The girl is talking on her cellphone while skating down the street .;
4850651669.jpg| 4| A man dressed as a woman roller-blading .;
4851524954.jpg| 0| Two women sit at an outdoor cafe table laden with teapots and cups while other people sit at other tables in the background .;
4851524954.jpg| 1| There are four women and one man sitting at tables having tea at a sidewalk cafe .;
4851524954.jpg| 2| An older woman looks off into the distance as she sits at an outdoor restaurant .;
4851524954.jpg| 3| Women are enjoying beverages at a restaurant outside .;
4851524954.jpg| 4| mother and daughter sitting down having coffee .;
4851882232.jpg| 0| A man with long hair is bending down to get something , as a woman and child , both in baseball caps , sit on the ground and watch .;
4851882232.jpg| 1| A man is bent over examining something while two ladies in beige hats are watching .;
4851882232.jpg| 2| A long-haired man looks at different items while two women sit in front of him .;
4851882232.jpg| 3| A man and children setting up a stand to sell jewelery .;
4851882232.jpg| 4| A group of people with jewelry for sale .;
485356704.jpg| 0| A black woman in a building is handing back a card to someone , she is wearing a worker 's uniform .;
485356704.jpg| 1| A woman is standing in a booth , wearing and orange vest , proffering a credit card and smiling .;
485356704.jpg| 2| A black lady with an orange vest is handing back a card through a checkout window .;
485356704.jpg| 3| A woman in a security booth is handing a card to the photographer of this photo .;
485356704.jpg| 4| A lady wearing an orange vest is handing back a card .;
485566887.jpg| 0| Two dogs are fighting and playing with each other while running through some grass .;
485566887.jpg| 1| Two brown dogs with blue collars are running in the grass .;
485566887.jpg| 2| One dog biting at another dog 's face in a grassy field .;
485566887.jpg| 3| There are two brown dogs playing in field .;
485566887.jpg| 4| Two dogs are playing in the grass .;
4855964619.jpg| 0| Two men in suits and a woman in a white outfit playing instruments on wheels .;
4855964619.jpg| 1| Two men and a woman standing behind brown one man band rolling appliances;
4855964619.jpg| 2| Two men in bowler hats and a woman are performing on a street .;
4855964619.jpg| 3| Musicians are performing outdoors for money .;
4855964619.jpg| 4| Three people are performing music .;
4857157703.jpg| 0| a young man with blond-hair and purple shirt carrying a black bag across his chest in front of a red and yellow painted bus .;
4857157703.jpg| 1| A person in a purple shirt rubs their eyes under their glasses as the stand in front of a red and yellow bus .;
4857157703.jpg| 2| This young Child , in the Blue Shirt , is working up his Muscles , or he has a bad tooth ache;
4857157703.jpg| 3| A man in a purple shirt and blue jeans playing the harmonica by a red bus .;
4857157703.jpg| 4| A young man in a purple shirt cracks his neck using his own hands .;
4857278968.jpg| 0| One woman watches while another woman helps herself to a plate of food .;
4857278968.jpg| 1| Asian ladies serving food to what it looks to be an Asian restaurant .;
4857278968.jpg| 2| A large basket of dumplings in an asian cafeteria setting .;
4857278968.jpg| 3| People serving food in a kitchen line .;
4857278968.jpg| 4| Asian buffet style restaurant .;
4859528111.jpg| 0| This is actually two different images and they are both of men wearing brightly colored blue and red clothing walking in front of onlookers .;
4859528111.jpg| 1| This is a double image of a man , woman , and child watching two different men in cultural attire walk by carrying guns .;
4859528111.jpg| 2| A family is sitting on a curb while men in red and blue costumes walk by .;
4859528111.jpg| 3| A family of three people are watching men in costumes pass by .;
4859528111.jpg| 4| A couple and child are watching people walk by .;
4859795235.jpg| 0| A black man holds a bundle of papers near a wooden structure cover with papers that have words written on them .;
4859795235.jpg| 1| A man in a black shirt holding cloth next to a wooded structure as people walk around it .;
4859795235.jpg| 2| A man in black shirt and cargo pants adds paper to a wooden and paper structure .;
4859795235.jpg| 3| Man gathers paper near a structure made of wood covered with paper and graffiti .;
4859795235.jpg| 4| Multiple people on a city street building a memorial out of wooden plaques .;
486016665.jpg| 0| Two woman with long hair and ponytails jog along the roadside .;
486016665.jpg| 1| Two girls jogging in a park along side a pond with cyclists .;
486016665.jpg| 2| Two women jogging through a road by the waterside .;
486016665.jpg| 3| Two women jogging on a paved trail around a lake .;
486016665.jpg| 4| Two women jog down the street .;
4861410931.jpg| 0| A busy street with building lined up and people walking down the street outside and nighttime .;
4861410931.jpg| 1| Someone enjoying taking a picture of a midway at a permanent entertainment venue .;
4861410931.jpg| 2| The boardwalk is very brightly lit by restaurant signs at night .;
4861410931.jpg| 3| A boardwalk with bars and restaurants and a lot of people .;
4861410931.jpg| 4| A crowd of people outside the Beachcomber bar and grill .;
4861590390.jpg| 0| A lady in a blue-green costume standing outside .;
4861590390.jpg| 1| A woman in a blue , green , and gold costume .;
4861590390.jpg| 2| A costume with vibrant blue and green colors .;
4861590390.jpg| 3| A lady wearing a celebratory bug dress;
4861590390.jpg| 4| A woman is wearing a peacock costume .;
4862594943.jpg| 0| A young man in a blue jacket holds a fish while sitting on a rowboat on a river with a young boy wearing a red jacket .;
4862594943.jpg| 1| Two young boys are sitting in a canoe , the one in the foreground is holding a medium sized fish .;
4862594943.jpg| 2| two teenage boys in a boat , one holding a fish with calm water and trees in background;
4862594943.jpg| 3| A boy is standing in a boat , holding up a fish to the camera and smiling .;
4862594943.jpg| 4| Two young men in a boat while one holds up a fish .;
4864177176.jpg| 0| A little boy in a black shirt is carrying a blue bag in back of him and a teal bucket in front of him .;
4864177176.jpg| 1| A middle eastern boy is wearing a black shirt and carrying a blue bag and a blue bucket .;
4864177176.jpg| 2| A boy in a black shirt carries a blue bucket while walking with men dressed in white .;
4864177176.jpg| 3| A boy dressed in a dark shirt carries a blue bag over his shoulder and a green pail .;
4864177176.jpg| 4| A child carries a bag and a bucket through the street .;
4865845932.jpg| 0| A worker wearing a dust mask and suit cleans a large mirror inside a factory building .;
4865845932.jpg| 1| A man in white coveralls and a respirator is polishing a large , curved mirror .;
4865845932.jpg| 2| Man cleaning a huge reflective disk , while wearing a protective mask .;
4865845932.jpg| 3| A person in a full-body suit working on a big piece of metal .;
4865845932.jpg| 4| A worker dressed in a clean suit polishes a large mirror .;
4866398248.jpg| 0| a woman enjoying a sucker is looking out over a railing .;
4866398248.jpg| 1| A girl is eating a lollipop in front of a building .;
4866398248.jpg| 2| A girl holds a red lollipop in front of a building .;
4866398248.jpg| 3| A woman is eating a sucker outside of a building .;
4866398248.jpg| 4| Woman looking out from an overlooking building .;
4867849913.jpg| 0| A woman behind a fair booth filled with stuffed animals talks to a man with a blue shirt on the other side .;
4867849913.jpg| 1| Man in blue shirt talking to woman behind a counter with stuffed animals hanging all around them .;
4867849913.jpg| 2| People walk around at a carnival where large stuffed animals are on display .;
4867849913.jpg| 3| People standing in and in front of a booth full of stuffed animals .;
4867849913.jpg| 4| A young man talks to the operator of a prize booth .;
486852199.jpg| 0| children in orange and neon green play soccer as their coach watches .;
486852199.jpg| 1| 2 kids soccer teams playing with coach in the background watching .;
486852199.jpg| 2| Four girls are playing soccer while an adult looks over them .;
486852199.jpg| 3| Little girls having a soccer match and a man watching .;
486852199.jpg| 4| Four girls playing soccer while the coach looks on .;
487071033.jpg| 0| Boy dressed in black is doing a skateboarding jump with a crowd watching .;
487071033.jpg| 1| People watching a guy in a black and green baseball cap skateboarding .;
487071033.jpg| 2| A man does skateboard tricks off a ramp while others watch .;
487071033.jpg| 3| A skateboarder doing a trick off a quarter pipe .;
487071033.jpg| 4| A skateboarder does a trick for an audience .;
4872410393.jpg| 0| A young girl wearing a red shirt and cap smiling and holding a small toy is standing in front of a group of children playing behind her .;
4872410393.jpg| 1| A girl in a red shirt plays with an orange and blue toy , as other children sit and play in the background .;
4872410393.jpg| 2| A young girl wearing a red hat and sweater smiles at the camera while holding a toy .;
4872410393.jpg| 3| A little girl in a red pull over holding a toy in both hands smiling .;
4872410393.jpg| 4| A child in a red sweatshirt and hat holding a toy .;
4872490297.jpg| 0| Two children , one male the other female in a room , the female is getting into a chair .;
4872490297.jpg| 1| Children are playing in a classroom setting : one of them is climbing onto a chair .;
4872490297.jpg| 2| A girl in a pink sweatshirt goes to sit at a table while a boy watches .;
4872490297.jpg| 3| Two young children are in a room dressed in blue pants .;
4872490297.jpg| 4| A girl in a pink shirt is climbing onto a wooden chair .;
4872515943.jpg| 0| A man in a black and white pinstripe hat and white shirt with blue streaks writes on the arm of another person with black ink .;
4872515943.jpg| 1| A bearded man with a striped hat draws a tattoo on someone 's forearm .;
4872515943.jpg| 2| A man wearing a black striped hat is tattooing another person 's arm .;
4872515943.jpg| 3| A man wearing a black hat painting on another man 's arm .;
4872515943.jpg| 4| A tattoo artist wearing a hat at work .;
487487795.jpg| 0| Two dogs on hind legs with faces near each other on a grassy field .;
487487795.jpg| 1| A black and brown dog is playing with a brown and white dog .;
487487795.jpg| 2| Two dogs leap toward each other on a grassy lawn .;
487487795.jpg| 3| Two dogs are playing on the grass .;
487487795.jpg| 4| Two dogs playing .;
4876248951.jpg| 0| A woman in a green apron uses a meat cleaver to cut up an animal .;
4876248951.jpg| 1| A woman in a green apron is carving meat from an animal carcass .;
4876248951.jpg| 2| A woman in a teal apron prepares a meal at a restaurant .;
4876248951.jpg| 3| A woman is carving an animal .;
4876248951.jpg| 4| A woman preparing some pork .;
4877883053.jpg| 0| Cyclist participating in an organized event cross a large suspension bridge and two women riders have stopped to pose for a picture .;
4877883053.jpg| 1| Two female bikers pose on a bridge as other riders travel by in a marathon .;
4877883053.jpg| 2| A big group of bicyclist are riding around on a large bridge .;
4877883053.jpg| 3| Women posing for a picture during a bicycle race on a bridge .;
4877883053.jpg| 4| There are many participants in this bike race .;
