2720039582.jpg| 1| One football player caught a pass while the two players from the opposite team attempt to tag him while he 's on the ground .;
2720039582.jpg| 2| Three football players are huddled together while one player is falling and holding the football .;
2720039582.jpg| 3| A football player catching the ball while going down .;
2720039582.jpg| 4| Three football players struggle for the ball .;
2720167660.jpg| 0| A boy jumped off a wooden structure onto a floatation device on the water .;
2720167660.jpg| 1| Boys are playing near water and one of them is jumping .;
2720167660.jpg| 2| A young man jumps into the water from a floating slide .;
2720167660.jpg| 3| Children play on a slide in a lake .;
2720167660.jpg| 4| A boy jumping into the water .;
272045297.jpg| 0| A Chinese man inside a restaurant waiting for people to enter .;
272045297.jpg| 1| a chinese man sitting down waiting for customers .;
272045297.jpg| 2| The restaurant worker looks outside of the door .;
272045297.jpg| 3| An Asian man in white working in a kitchen .;
272045297.jpg| 4| A businessman looking out his door .;
2725089128.jpg| 0| Two young Indian girls one in white is jumping rope and another in yellow is looking away .;
2725089128.jpg| 1| Two young girls in dresses stand together in front of a yellow wall .;
2725089128.jpg| 2| Two girls together and one in polka dot dress is jumping rope .;
2725089128.jpg| 3| Two young girls are outside in dresses .;
2725089128.jpg| 4| Two girls are standing outside .;
2726791588.jpg| 0| Mike Holmgren on the field with his team the Seattle Seahawkss talking over practice details with an assistant coach .;
2726791588.jpg| 1| Two men , one in a red shirt on in a blue , stand on a football field talking to each other .;
2726791588.jpg| 2| Two coaches stand in the middle of a football field looking over a piece of paper .;
2726791588.jpg| 3| Two men are standing on a football field by football players .;
2726791588.jpg| 4| Football players practice on the field .;
2735827522.jpg| 0| A black woman singing on stage with a drum-set in the background .;
2735827522.jpg| 1| A singer of band is either performing or practicing on stage;
2735827522.jpg| 2| A singer on a stage is singing into a microphone .;
2735827522.jpg| 3| A woman in red shirt is singing .;
2735827522.jpg| 4| A woman is singing on stage .;
2745656473.jpg| 0| A bald man in white linens plays a musical instrument on a red rug outside .;
2745656473.jpg| 1| A bald man wearing white is sitting on the ground playing a sitar .;
2745656473.jpg| 2| A man is sitting down and playing a guitar like instrument .;
2745656473.jpg| 3| The man is playing a stringed instrument on the ground .;
2745656473.jpg| 4| Crazy krishna playing a ukulele on the ground .;
274604264.jpg| 0| A man wearing a red bicycle helmet is buried in fallen tree leaves with two young boys with playground equipment and trees with golden leaves in the background .;
274604264.jpg| 1| A man with a bike helmet and two young boys have just their heads peeking up from a pile of leaves .;
274604264.jpg| 2| A man wearing a bicycle helmet and two young boys are covered in fall leaves in a playground .;
274604264.jpg| 3| Two children an adult wearing a bicycle helmet playing in a pile of fall leaves .;
274604264.jpg| 4| A man and two boys lay in autumn leaves at a playground .;
275170445.jpg| 0| A woman wearing a large pink and white hat is sitting next to several men wearing blue and white shirts with yellow sashes and in front of several drums topped with the same type of pink and white hat .;
275170445.jpg| 1| A group of people are sitting next to each other with some wearing white shirts and blue vests with yellow sashes and the others wearing large fluffy white hats with a pink fluffy top .;
275170445.jpg| 2| Asian men sitting down , and some of them are wearing white and pink hats , while the others are wearing blue jackets with yellow sashes .;
275170445.jpg| 3| Two people in blue and white outfits are sitting next to one person in a red and white outfit .;
275170445.jpg| 4| Group of Asians sitting down in traditional wear .;
2752329719.jpg| 0| Two people sit on a well kept stone path that overlooks a large body of water .;
2752329719.jpg| 1| A couple is enjoying the view of the water while sitting on a patio .;
2752329719.jpg| 2| Couple sitting on chairs by a stone wall overlooking the ocean .;
2752329719.jpg| 3| Two adults sitting in chairs overlooking the ocean;
2752329719.jpg| 4| A couple sit on a patio overlooking the ocean .;
275618737.jpg| 0| A young girl with blond , braided hair sits in the floor holding a pink toothbrush , with a happy birthday banner on the back of the sofa behind her .;
275618737.jpg| 1| A blond woman holds an object in her mouth and a pink toothbrush in her hand while sitting in front of a brightly colored couch .;
275618737.jpg| 2| A blond girl in a blue camisole has something in her mouth and is holding a toothbrush .;
275618737.jpg| 3| a girl is posed holding a toothbrush with some form of box in her mouth .;
275618737.jpg| 4| A girl with blond-hair is sitting on the floor holding a toothbrush .;
2760167.jpg| 0| A singing group performs a song at a upscale event .;
2760167.jpg| 1| A choir is singing , dressed in bowties and tuxes .;
2760167.jpg| 2| Men in red bowties are singing in a choir .;
2760167.jpg| 3| A choir is singing to an audience .;
2760167.jpg| 4| Nine men wearing tuxedos sing .;
27683428.jpg| 0| Two men , one bare-chested while the other wears a hat and blue shirt , in a canoe on water .;
27683428.jpg| 1| One man without a shirt and a man with a hat steering are in a small boat .;
27683428.jpg| 2| Two men with oars , one with a helmet , are riding in a canoe .;
27683428.jpg| 3| People are rowing a boat in the water .;
27683428.jpg| 4| A few people on a canoe in the water .;
2768397923.jpg| 0| A radio station DJ with a full beard and long dreads , smiles for the camera .;
2768397923.jpg| 1| A man with dreadlocks is sitting near music mixing equipment .;
2768397923.jpg| 2| A man with dreadlocks smiles while sitting in a dj booth .;
2768397923.jpg| 3| A man with black dreadlocks and a checkered shirt smiles .;
2768397923.jpg| 4| A man in a striped shirt smiling .;
276984593.jpg| 0| A young man wearing shorts and a white t-shirt is sleeping on a black leather couch .;
276984593.jpg| 1| A man in a white t-shirt and beige shorts lies asleep on a black sofa .;
276984593.jpg| 2| A man in a white t-shirt and khaki shorts sleeps on a leather couch .;
276984593.jpg| 3| A dark headed boy sleeping on a leather couch .;
276984593.jpg| 4| A man sleeping on a black couch .;
2771662950.jpg| 0| A baseball player is standing in place , catching a flying baseball in his mitt .;
2771662950.jpg| 1| A player for the Detroit Tigers is catching a baseball being thrown to him .;
2771662950.jpg| 2| A male baseball player catches a baseball in his mitt .;
2771662950.jpg| 3| Baseball player in a 22 jersey catching a baseball .;
2771662950.jpg| 4| baseball player catches a ball with ease .;
2771971891.jpg| 0| A person para-glides on the shore of a large body of water , heading towards an unseen landing location .;
2771971891.jpg| 1| This active person is sky flying in the beautiful and clam blue sky .;
2771971891.jpg| 2| A person is sailing in the air with a red parachute over grass .;
2771971891.jpg| 3| A red parasail is floating over the grassy beach and ocean .;
2771971891.jpg| 4| A para-glider flying over a grassy field .;
2773331947.jpg| 0| The elderly woman is cooking three large bowls of food .;
2773331947.jpg| 1| woman cooking food in big kettles and stirring .;
2773331947.jpg| 2| A foreign man is preparing an ethnic dish .;
2773331947.jpg| 3| A lady making large quantities of food .;
2773331947.jpg| 4| A woman cooking food on hot stove .;
2774356224.jpg| 0| A friend photo with two boys looking at each other while the girl looks at the camera smiling .;
2774356224.jpg| 1| A man and a woman in a gray business shirt pose with a man in an orange shirt .;
2774356224.jpg| 2| A woman smiles at the camera while two guys make a face toward each other .;
2774356224.jpg| 3| A group of friends posing for a photo .;
2774356224.jpg| 4| A candid moment between three friends .;
2775068620.jpg| 0| A man in a white shirt and glasses tries to hale a cab while holding his daughter wearing a yellow t-shirt .;
2775068620.jpg| 1| A man holds a small child while pointing something out in the distance , while in the city .;
2775068620.jpg| 2| A man is pointing and perhaps showing the child he is holding something .;
2775068620.jpg| 3| A father and his daughter need a taxi .;
2775068620.jpg| 4| Man holding a little girl in a street .;
2783620390.jpg| 0| Motorcycle rider crouches on bike , blurry background .;
2783620390.jpg| 1| A motorcycle racer is riding a black motorcycle .;
2783620390.jpg| 2| A motorcyclist is going a very high speeds .;
2783620390.jpg| 3| A motorcyclist is speeding on a road .;
2783620390.jpg| 4| A person rides a motorcycle quickly .;
2788933694.jpg| 0| A woman wearing a blue shirt looking into a black telescope during the day while a woman in a red shirt stands behind her .;
2788933694.jpg| 1| A young woman in a blue shirt looks into a telescope outside while another woman in a red shirt observes her .;
2788933694.jpg| 2| A young girl in a blue t-shirt is looking through a telescope while another girl in a red shirt watches .;
2788933694.jpg| 3| A lady in blue , taking a close look of the surroundings by looking in the standing camera at park .;
2788933694.jpg| 4| A girl with a blue shirt using a telescope with two friends .;
279047277.jpg| 0| In China , a man gets out of a port-a-potty while another man waits .;
279047277.jpg| 1| Chinese man coming out of blue porta potty .;
279047277.jpg| 2| A man walking out of a portable bathroom .;
279047277.jpg| 3| Two men use porta johns in the far east .;
279047277.jpg| 4| A man steps out of a blue porta potty .;
2800934095.jpg| 0| The small brown dog is running through the grass with a yellow ball in its mouth .;
2800934095.jpg| 1| A dog is running through a low-cut field with a ball .;
2800934095.jpg| 2| A weiner dog catches a blue and yellow tennis ball .;
2800934095.jpg| 3| A little brown dog has a ball in its mouth .;
2800934095.jpg| 4| A dachshund returning a tennis ball .;
2804904604.jpg| 0| A small blond boy plays with a rubber paint-spattered mallet .;
2804904604.jpg| 1| A young blond boy holds a mallet in front of his face .;
2804904604.jpg| 2| A young boy in a white shirt with a rubber mallet .;
2804904604.jpg| 3| A young boy is lifting up a mallet .;
2804904604.jpg| 4| A kid is holding a rubber mallet .;
280706862.jpg| 0| A black dog emerges from the water onto the sand , holding a white object in its mouth .;
280706862.jpg| 1| a black dog walking out of the water with a white ball in his mouth .;
280706862.jpg| 2| A black dog emerges from the water with a white ball in its mouth .;
280706862.jpg| 3| The black dog jumps out of the water with something in its mouth .;
280706862.jpg| 4| A black dog on a beach carrying a ball in its mouth .;
2808098783.jpg| 0| A brown and white dog is licking a dog that looks very similar .;
2808098783.jpg| 1| A brown and white dog is licking a small brown terrier .;
2808098783.jpg| 2| Two brown and white dogs are standing on a sidewalk .;
2808098783.jpg| 3| Two small brown and white dogs stand together .;
2808098783.jpg| 4| Two blurry dogs .;
280932151.jpg| 0| A white dog running from a wooded area .;
280932151.jpg| 1| Dog runs through trees toward camera;
280932151.jpg| 2| A white dog runs toward the camera .;
280932151.jpg| 3| A white dog running through woods .;
280932151.jpg| 4| The white dog looks happy running .;
2811918074.jpg| 0| Two dancers in matching blue unitards are performing .;
2811918074.jpg| 1| Two people are dressed in leotards performing .;
2811918074.jpg| 2| Two acrobats in blue leotards perform .;
2811918074.jpg| 3| Two people are wearing blue suits .;
2811918074.jpg| 4| a female performing at a ballet .;
2812590023.jpg| 0| A man is photographing a Budweiser sprint car at a speedway smoking its tires .;
2812590023.jpg| 1| A Budweiser-sponsored race car accelerates quickly with smoke behind it .;
2812590023.jpg| 2| A dragster is taking off and leaving a huge trail of smoke behind him .;
2812590023.jpg| 3| Smoke is spewing out of the back of a red race car on a racetrack .;
2812590023.jpg| 4| Red racing car on track blowing smoke;
2815507707.jpg| 0| People seated outside a Shake Shack , eating food and socializing .;
2815507707.jpg| 1| A crowd surrounds the Shake Shack on a New York City evening .;
2815507707.jpg| 2| The Shake Shack is a favorite teen hangout most evenings .;
2815507707.jpg| 3| Several men and women are enjoying food outdoors .;
2815507707.jpg| 4| The Shake Shack is a crowded restaurant .;
281706216.jpg| 0| A man in a straw hat is digging with a shovel .;
281706216.jpg| 1| A man wearing a white hat is shoveling dirt .;
281706216.jpg| 2| A man uses a shovel to dig in a green field .;
281706216.jpg| 3| An older man digging a hole .;
281706216.jpg| 4| A man in a hat is digging .;
2825668136.jpg| 0| Bike rider jumps off of gray stone rise , does trick in air .;
2825668136.jpg| 1| A man is performing a jumping trip on his bicycle .;
2825668136.jpg| 2| A bike rider jumping off his bike , doing a trick;
2825668136.jpg| 3| A man with a bike jumps high above the concrete .;
2825668136.jpg| 4| A guy is doing a trick on a bike .;
2829719998.jpg| 0| A man wearing high visibility green safety attire is trying to climb on a Davey bucket truck .;
2829719998.jpg| 1| A man in a reflective vest is climbing aboard his work truck .;
2829719998.jpg| 2| A maintenance worker is climbing into his green truck .;
2829719998.jpg| 3| A man wearing a hard hat climbs into a work truck .;
2829719998.jpg| 4| A worker is climbing into his bucket truck .;
2847633529.jpg| 0| A couple has been photographed through a gap in the fence while they are sitting near the water .;
2847633529.jpg| 1| A couple , a man and a woman , are sitting on a rock looking at the ocean .;
2847633529.jpg| 2| A couple , sitting and holding each other , look at an ocean view .;
2847633529.jpg| 3| A couple sitting on rocks looking out at the ocean .;
2847633529.jpg| 4| A man and a woman sitting by the water .;
2848266893.jpg| 0| The man holding a newspaper is wearing a white suit , black shirt and black shoes .;
2848266893.jpg| 1| a man wearing a white suit holding a newspaper walking through the streets .;
2848266893.jpg| 2| A man in a white suit walks down the street holding a newspaper .;
2848266893.jpg| 3| The man is wearing a white suit and walking on the street .;
2848266893.jpg| 4| A man in a white suit walks outside carrying a newspaper .;
2856700762.jpg| 0| Two hikers carrying backpacks are standing in front of a path patiently looking over at something and waiting patiently .;
2856700762.jpg| 1| There are two young people with backpacks on and then are standing next to a hiking trail .;
2856700762.jpg| 2| Two hikers stopping to rest in the shade on a bright sunny day .;
2856700762.jpg| 3| Two men with backpacks hiking up a trail .;
2856700762.jpg| 4| Two hikers standing at a trail head .;
2857558098.jpg| 0| A dog with a branch in its mouth .;
2857558098.jpg| 1| A dog is chewing on a big branch .;
2857558098.jpg| 2| A little dog chews on a big stick;
2857558098.jpg| 3| Small dog chews on a big stick .;
2857558098.jpg| 4| a dog shews on a big stick .;
2860035355.jpg| 0| A photograph taken at night of a street scene and a man looking in the street;
2860035355.jpg| 1| An elderly man is standing outside at night , gazing at the street .;
2860035355.jpg| 2| This is a night view of a city street with people and traffic .;
2860035355.jpg| 3| A man looks across a city street at night .;
2860035355.jpg| 4| a man sits in the city at night .;
2860432302.jpg| 0| A butcher in a yellow shirt is looking at a slab of fish meat on a wooden butcher block .;
2860432302.jpg| 1| A man with short black hair in a yellow shirt looking at a large piece of cut fish .;
2860432302.jpg| 2| A man is staring down at half of a fish .;
2860432302.jpg| 3| Man with filleted fish on wooden board .;
2860432302.jpg| 4| a man slicing the meat in the market;
2863349041.jpg| 0| Two infants , one standing and one sitting , are in a bathroom .;
2863349041.jpg| 1| Two little kids playing with toilet paper in the bathroom .;
2863349041.jpg| 2| Two children play in a pile of unspooled toilet paper .;
2863349041.jpg| 3| Two young children playing with toilet paper .;
2863349041.jpg| 4| Two little children playing in the bathroom .;
2864577025.jpg| 0| A man in a white coat and blue shirt is preparing some kabobs on a skewer .;
2864577025.jpg| 1| an older man in a white shirt prepares raw meat on a stick;
2864577025.jpg| 2| A man in a white and blue shirt is making a kabob .;
2864577025.jpg| 3| A man in a white shirt is making shish kabob .;
2864577025.jpg| 4| An older man seasoning a shish kabob .;
2866254827.jpg| 0| A man on a yellow sport bike does a wheelie as his friend on a black bike catches up .;
2866254827.jpg| 1| Two motorcyclists on a blurry road , one rider doing a wheelie .;
2866254827.jpg| 2| The orange rider is driving a motorcycle on one wheel .;
2866254827.jpg| 3| A man on a motorcycle riding on his back tire .;
2866254827.jpg| 4| A yellow motorcyclist is popping a wheelie .;
2870015912.jpg| 0| A woman in a black shirt and a girl in an orange shirt are looking at a brochure .;
2870015912.jpg| 1| a woman and young girl looking through a selection of books .;
2870015912.jpg| 2| A woman helping a little girl pick out and read a book .;
2870015912.jpg| 3| A woman and a young girl look through a book together .;
2870015912.jpg| 4| A woman and young girl are looking at a book .;
2873522522.jpg| 0| A rugby player has emerged from the pack with the ball in his hands .;
2873522522.jpg| 1| Rugby player in red gets ready to toss the ball .;
2873522522.jpg| 2| Ruggers are competing in a fierce game of rugby;
2873522522.jpg| 3| Men playing a game in red uniforms;
2873522522.jpg| 4| A group of men play soccer .;
2876994989.jpg| 0| The person with the face paint and football jersey is sitting in bleachers;
2876994989.jpg| 1| A person with face paint is staring at something from within a crowd .;
2876994989.jpg| 2| NFL Fan with their face painted white , blue , and yellow .;
2876994989.jpg| 3| A football fan showing his devotion by painting his face .;
2876994989.jpg| 4| A sports fan is wearing face paint in the stands .;
2877155196.jpg| 0| Three men , one shirtless and the other two clothed , are on the roof of a building that is having construction performed on it .;
2877155196.jpg| 1| Three men , two with shirts , one without working on the roof of a house .;
2877155196.jpg| 2| Three men are working on the roof of a white house .;
2877155196.jpg| 3| A few men are working on repairing a roof .;
2877155196.jpg| 4| Three men repairing a rooftop .;
2883749170.jpg| 0| Here is a picture of a construction crew getting ready to go to work on a skyscraper .;
2883749170.jpg| 1| A group of construction workers walk past a building under construction .;
2883749170.jpg| 2| A crew of construction workers stand in green vests before a building .;
2883749170.jpg| 3| There is a group of people standing in a construction site .;
2883749170.jpg| 4| Cranes work on the frame of a building under construction .;
2888479483.jpg| 0| A young blond girl with pigtails and a young boy in a red jersey eat cereal with their mouths open .;
2888479483.jpg| 1| A young blond girl and brown-haired boy are eating cereal at a table .;
2888479483.jpg| 2| A little girl and boy dressed in red eat cereal out of purple bowls .;
2888479483.jpg| 3| Two young children , a girl and a boy , eat Cheerios with spoons .;
2888479483.jpg| 4| A young boy and girl eating breakfast cereal .;
2891300143.jpg| 0| A man pats the back of an old bearded man with a cane sitting next to him .;
2891300143.jpg| 1| An old man with a long gray beard sits on a stoop with two other men .;
2891300143.jpg| 2| Two men are talking with each other while a third sits next to them .;
2891300143.jpg| 3| Two old people are speaking on a sidewalk .;
2891300143.jpg| 4| Men sitting and conversing .;
2894576909.jpg| 0| a lone person in a red boat on a wild river with only one padel;
2894576909.jpg| 1| This person in a red kayak faces a challange in the rapids .;
2894576909.jpg| 2| A kayaker crashes against the force of the wave .;
2894576909.jpg| 3| A man pilots a kayak through rough rapids .;
2894576909.jpg| 4| A person riverrafting .;
2901375404.jpg| 0| A man wearing blue pants is standing on a ladder , working on building the roof of a dome on a white building .;
2901375404.jpg| 1| A man on a ladder repairs bronze shingles on the roof of a building .;
2901375404.jpg| 2| A man is working on building a gold , dome-shaped roof .;
2901375404.jpg| 3| A man on a ladder repairs the roof of a building .;
2901375404.jpg| 4| The man works on the roof of the building .;
2905200744.jpg| 0| Two people wearing helmets riding in a four wheeler along next to the ocean .;
2905200744.jpg| 1| Two people with white helmets on riding in a Yamaha red and black vehicle .;
2905200744.jpg| 2| Two people in a white and red Yamaha vehicle driving next to the ocean .;
2905200744.jpg| 3| Two men in a black in red vehicle on the beach .;
2905200744.jpg| 4| Two people are riding a Yamaha on the beach .;
2908834379.jpg| 0| Several children are raising their hands while sitting on a colorful rug in a classroom .;
2908834379.jpg| 1| Some in a group of young students sitting on a rug are raising their hands .;
2908834379.jpg| 2| A group of children are sitting cross-legged in a classroom .;
2908834379.jpg| 3| Children in a classroom sitting on a numbered rug .;
2908834379.jpg| 4| Children raising their hands in class;
2911238432.jpg| 0| Eight children wearing life jackets are in the water on a raft made of innertubes and noodles .;
2911238432.jpg| 1| A group of people are paddling their way across the water .;
2911238432.jpg| 2| A group of kids float in the middle of a pond .;
2911238432.jpg| 3| Some children are sitting on rafts in a lake .;
2911238432.jpg| 4| Children float on the water in a raft .;
2913818905.jpg| 0| Two dogs , one black , the other black and white runs on the beach .;
2913818905.jpg| 1| A black dog and a black and white dog are running on sandy ground .;
2913818905.jpg| 2| A black dog and a black and white dog are running in dirt .;
2913818905.jpg| 3| Two large dogs run in the sand .;
2913818905.jpg| 4| Two dogs running on wet sand .;
2917248300.jpg| 0| A baby in a stroller , and several men sit below a structure that is casting striped shadows on them .;
2917248300.jpg| 1| The people are sitting at tables under the pergola .;
2917248300.jpg| 2| People are sitting outside on a deck at tables .;
2917248300.jpg| 3| People sitting outside with lattice shadows .;
2917248300.jpg| 4| People sit , eat , and relax in the shade .;
291768952.jpg| 0| This guy in the green shirt is showing how easy it is to jump and act a fool on wet surface .;
291768952.jpg| 1| Man in jeans and sweatshirt jumping in air on wet surface that shows reflection .;
291768952.jpg| 2| A man is posing with all of his limbs stretched out over a body of water .;
291768952.jpg| 3| One man outside , jumping in the air with his arms and legs spread out .;
291768952.jpg| 4| A person jumps over a pool of water and their reflection is shown .;
2918880895.jpg| 0| A man in a yellow shirt and a man in a blue shirt and tie posing for a picture .;
2918880895.jpg| 1| A man in a yellow and yellow shirt puts his arm around a man in a blue shirt .;
2918880895.jpg| 2| Two men each have one arm around each other and are in formal dresswear;
2918880895.jpg| 3| Two guys , one black and one white , smiling for the camera .;
2918880895.jpg| 4| Two employees pose for a picture .;
2924259848.jpg| 0| The motorcycle racer is taking a curve on the dirt track .;
2924259848.jpg| 1| A man riding a motorbike kicks up dirt .;
2924259848.jpg| 2| a dirt biker turns across the dirt .;
2924259848.jpg| 3| A person rides a dirt bike .;
2924259848.jpg| 4| A dirt bike takes a turn .;
2925125303.jpg| 0| One black man and one caucasian man are at the front of the pack of otherwise predominantly Asian track runners ; all wearing shorts , running shoes and numbered paper race-bibs .
2925125303.jpg| 1| A bunch of race runners grouped together with red and blue balloons in the background .;
2925125303.jpg| 2| A group a man with numbers pinned to their shirts run in a race .;
2925125303.jpg| 3| A marathon of runners running on a red track .;
2925125303.jpg| 4| A crowd runs on a wide track for a race .;
2936071706.jpg| 0| Someone is carving a wooden dowel using a knife , their left hand and right foot- you mostly see their bare feet .;
2936071706.jpg| 1| An individual is scrapping the bottom of their right food with a blade they have in their hand .;
2936071706.jpg| 2| A barefoot man holding a sharp object is cutting a tan colored material .;
2936071706.jpg| 3| A person in tan pants is shaving skin off of their feet using a file .;
2936071706.jpg| 4| A man is crafting a wooden piece using a tool and his feet .;
2937611480.jpg| 0| Three people , two seated on a large rolled up piece of artifcial turf and a female standing talking to one of the seated men .;
2937611480.jpg| 1| Two men resting on a odd shaped bench , while one is talking with a woman .;
2937611480.jpg| 2| A group of people sit on a bench outside that looks like a tree trunk .;
2937611480.jpg| 3| A man is laying back while a man and woman look in his direction .;
2937611480.jpg| 4| A couple watching a man sleep on a piece of art .;
2939197393.jpg| 0| A mountain biker , wearing a black helmet and shirt , in motion .;
