2592398210.jpg| 3| A young girl is swimming in a pool .;
2592398210.jpg| 4| Girl in polka dot cap swimming .;
2594809039.jpg| 0| A man holding a cigarette is kissing a woman at a bar while people are sitting behind them .;
2594809039.jpg| 1| A man with a cigarette and a woman in a blue shirt are kissing in a bar .;
2594809039.jpg| 2| A man who is smoking a cigarette is kissing a woman in a blue shirt .;
2594809039.jpg| 3| A man in a gray shirt kissing a woman in a blue shirt at a bar .;
2594809039.jpg| 4| Man with cigarette kisses woman in bar .;
2596474836.jpg| 0| A woman in a white swim cap teaches a toddler how to swim in a swimming pool .;
2596474836.jpg| 1| A woman wearing a white swim cap holds a small boy in the swimming pool .;
2596474836.jpg| 2| A woman is holding a boy in a swimming pool .;
2596474836.jpg| 3| A woman helping a toddler to swim in a pool .;
2596474836.jpg| 4| Woman teaching young boy how to swim .;
2615217135.jpg| 0| A young man in a white t-shirt brushes his teeth while looking on in the mirror .;
2615217135.jpg| 1| The boy is looking into the bathroom mirror as he brushes his teeth .;
2615217135.jpg| 2| A young man is brushing his teeth in front of a mirror .;
2615217135.jpg| 3| Young man brushing his teeth in front of a mirror .;
2615217135.jpg| 4| An asian male brushing his teeth at a white sink .;
2617215392.jpg| 0| A man dressed in a black T-shirt is holding a cellphone .;
2617215392.jpg| 1| A dark-skinned man handing someone his phone .;
2617215392.jpg| 2| A man offers his phone across the table .;
2617215392.jpg| 3| a man sits at a table holding his phone .;
2617215392.jpg| 4| An Indian man with a big cellphone .;
2619267133.jpg| 0| a young boy wearing a cowboy hat and riding on a horse;
2619267133.jpg| 1| A young boy in a cowboy hat rides a large horse .;
2619267133.jpg| 2| A young boy in a cowboy hat rides a horse .;
2619267133.jpg| 3| A young boy rides a red horse .;
2619267133.jpg| 4| Boy riding a horse .;
2620483456.jpg| 0| A happy little boy bounces down a large balloon slide wearing a red t-shirt and white socks .;
2620483456.jpg| 1| Young boy in a red shirt and white socks jumps down an inflatable slide .;
2620483456.jpg| 2| A small boy in shorts and a red shirt , airborne on an inflatable slide .;
2620483456.jpg| 3| A young boy is jumping down a large and colorful inflatable slide .;
2620483456.jpg| 4| A young child is jumping on an inflatable castle;
2623247254.jpg| 0| a young blond man sitting at a table with a brick wall in the background;
2623247254.jpg| 1| A guy talks and does something with his hand while others sit near him .;
2623247254.jpg| 2| Two men are sitting next to each other near to a vending machine .;
2623247254.jpg| 3| Two guys at a bar one dark-skinned and one light-skinned .;
2623247254.jpg| 4| A young man lights a lighter while another looks on .;
262817915.jpg| 0| A woman holding a cake in front of man with a suit who has something in his mouth .;
262817915.jpg| 1| A man puts a long object in his mouth while a woman holds a cake .;
262817915.jpg| 2| A man biting a candle while a woman holds a cake .;
262817915.jpg| 3| A smiling woman holds a cake near a man .;
262817915.jpg| 4| A man is playing with his birthday cake .;
2633722629.jpg| 0| A girl is upside-down on a trampoline and you can see her navel .;
2633722629.jpg| 1| A girl bounces upside down on her head on a trampoline .;
2633722629.jpg| 2| A girl is bouncing on her head on a trampoline .;
2633722629.jpg| 3| A child jumps upside down on a trampoline .;
2633722629.jpg| 4| A child flips on a trampoline .;
2638177115.jpg| 0| Men in khaki green pants having a conversation on a busy street .;
2638177115.jpg| 1| A few soldiers have a discussion while onlookers stand nearby .;
2638177115.jpg| 2| A military member talks to another while on the streets .;
2638177115.jpg| 3| The soldiers are preparing for security at a big event .;
2638177115.jpg| 4| An army man poses for a group of bystanders outside .;
264009676.jpg| 0| Two men in the grocery store looking at orange juice and speaking to each other .;
264009676.jpg| 1| A few people are observing the orange juice section at the grocery store .;
264009676.jpg| 2| Three people standing in the refrigerated juice aisle of a store .;
264009676.jpg| 3| Two men looking at a stack of various orange juice jugs .;
264009676.jpg| 4| Two men are shopping for orange juice .;
2641794279.jpg| 0| A person in white clothes and a yellow safety vest is riding a bike along a road .;
2641794279.jpg| 1| A safety patrol officer rides his bike across a crosswalk .;
2641794279.jpg| 2| A person wearing a hard hat rides a bicycle on the street .;
2641794279.jpg| 3| This boy is cycling to market to get vegetables .;
2641794279.jpg| 4| A Man riding his bike to work .;
264524370.jpg| 0| String orchestra and conductor in spotlight surrounded by darkness .;
264524370.jpg| 1| An orchestra playing on a dimly lit stage being led by a conductor .;
264524370.jpg| 2| A professional orchestra is playing in a dimly lit room .;
264524370.jpg| 3| A group of orchestra musicians playing in a dim room .;
264524370.jpg| 4| An orchestra surrounding the maestro .;
2646116932.jpg| 0| Two boys in a park , one standing near a tree and one sitting at a picnic table with the playground behind them .;
2646116932.jpg| 1| A young boy in a striped shirt is leaning against a tree while another child sits at a picnic table .;
2646116932.jpg| 2| A boy in a striped t-shirt is standing by a tree in front of the picnic tables .;
2646116932.jpg| 3| A little boy in a striped shirt is standing behind a tree .;
2646116932.jpg| 4| A boy hiding behind a tree;
2657844508.jpg| 0| A man and woman are sitting at a table in front of a sign that reads IL PORTO and two wine bottles and two wineglasses are on the table .;
2657844508.jpg| 2| An elderly couple are sitting outside a restaurant , enjoying wine .;
2657844508.jpg| 3| A couple is sitting at a restaurant in front of a big fish sign .;
2657844508.jpg| 4| Couple sitting on patio outside restaurant having some wine .;
2661294481.jpg| 0| a protest march is crossing the intersection of two streets near to a building with red awnings .;
2661294481.jpg| 1| a group of people holding signs and marching through the streets .;
2661294481.jpg| 2| A group of people with signs and banners walking down the street;
2661294481.jpg| 3| A crowd begins to march in a small downtown setting .;
2661294481.jpg| 4| Many people hold signs and march down the street .;
2662845514.jpg| 0| The man breaking the ice with his foot stands on a blue mat .;
2662845514.jpg| 1| A man doing a karate kick on a block of ice .;
2662845514.jpg| 2| A man karate kicks a stack of ice bricks .;
2662845514.jpg| 3| A martial artist breaks ice with a kick .;
2662845514.jpg| 4| A martial artist breaks a brick .;
2666307991.jpg| 0| Three gentlemen in business-formal attire drink and socialize at an indoor event , with two of the men looking off to the left and one of the men holding a bottle smiles for the camera .;
2666307991.jpg| 1| There are three men wearing dress clothes and standing around .;
2666307991.jpg| 2| Three males in collared shirts and ties celebrating .;
2666307991.jpg| 3| Three well dressed guys enjoying a social event .;
2666307991.jpg| 4| Three young men dancing at a party and drinking .;
2681215810.jpg| 0| a young topless man wearing sunglasses and shorts is holding a football .;
2681215810.jpg| 1| A man with no shirt and wearing sunglasses is holding a football .;
2681215810.jpg| 2| A man with no shirt on is holding a football .;
2681215810.jpg| 3| A shirtless man playing football on a lawn .;
2681215810.jpg| 4| A shirtless man catches a football;
2688102742.jpg| 0| A woman in a jeans skirt and t-shirt looking at a magazine display on the street .;
2688102742.jpg| 1| a girl wearing a short skirt looking at a rack of magazines on the sidewalk .;
2688102742.jpg| 2| Woman with black t-shirt and denim skirt looks at magazines on display .;
2688102742.jpg| 3| The woman stands looking at rows of magazines .;
2688102742.jpg| 4| The woman is browsing the magazine stand .;
2702506716.jpg| 0| A dog sticking his head out from under some gray stairs .;
2702506716.jpg| 1| Dog crawling in between steps from behind the steps;
2702506716.jpg| 2| A dog attempts to squeeze between two gray steps .;
2702506716.jpg| 3| A beagle is climbing through some gray stairs .;
2702506716.jpg| 4| Dog hiding under the stairs .;
2705102979.jpg| 0| a person in white shorts and shirt is doing a flip on the monkey bars .;
2705102979.jpg| 1| Someone is trying to do a flip on the swing set in the park .;
2705102979.jpg| 2| A boy is doing a skin-the-cat on some playground equipment .;
2705102979.jpg| 3| A person plays on monkey bars while others watch .;
2705102979.jpg| 4| Boys playing in the playground of a park .;
270724499.jpg| 0| a small tan dog running on the grass with a ball in his mouth;
270724499.jpg| 1| small dog running in the grass with a toy in its mouth;
270724499.jpg| 2| Dog running towards camera with a ball in its mouth .;
270724499.jpg| 3| A dog with a blue ball running in a field .;
270724499.jpg| 4| The dog is running with a colorful ball .;
2707602038.jpg| 0| Two contestant bicyclists speed past a crowd of spectators at an international bicycle racing event .;
2707602038.jpg| 1| A group of people are standing behind a fence watch two cyclists in a race .;
2707602038.jpg| 2| Two competing cyclists pedal past crowds of onlookers .;
2707602038.jpg| 3| People watching two men in a bicycle race .;
2707602038.jpg| 4| Two bicyclists race against each other .;
2711885008.jpg| 0| A boy hangs about six feet up in the lowest crook between branches of a large tree on a fenced-in , grassy hill .;
2711885008.jpg| 1| A small dark-haired boy climbing in a large tree .;
2711885008.jpg| 2| A kid in a white shirt is in a tall tree .;
2711885008.jpg| 3| A very young boy is up in a tree .;
2711885008.jpg| 4| A child stuck up in a tree .;
2715262147.jpg| 0| A group of people gathers on the grass in a backyard with tents , tables , and chairs set up .;
2715262147.jpg| 1| A young girl and a young man playing a toss game at an outside party .;
2715262147.jpg| 2| A man and a woman play Corn-hole at a party .;
2715262147.jpg| 3| Male and female playing game with beanbags .;
2715262147.jpg| 4| many people relax in the yard .;
2719343357.jpg| 0| A girl wearing a pink bathing suit top and sunglasses is playing in the sand next to a boy wearing red swim trunks .;
2719343357.jpg| 1| A woman and her son play in the sand on a sunny day in the beach .;
2719343357.jpg| 2| A young boy and girl in swimsuits play in the sand at the beach .;
2719343357.jpg| 3| Two teenagers at the beach playing in the sand;
2719343357.jpg| 4| A boy and girl play with the sand .;
2723220367.jpg| 0| A girl in a pink bikini is jumping off a diving board into a swimming pool .;
2723220367.jpg| 1| This teen is showing off her talent as she dives in a pool .;
2723220367.jpg| 2| A smiling woman in a bikini in the air over a diving board .;
2723220367.jpg| 3| A girl in a bikini is jumping off of a diving board .;
2723220367.jpg| 4| Girl in bikini jumps of diving board .;
2735158990.jpg| 0| A dog stands on its hind legs in a wooded area while another dog watches .;
2735158990.jpg| 1| A white dog is jumping in the air to catch a ball in the woods .;
2735158990.jpg| 2| A brown dog on his hind legs in the shadow of some trees .;
2735158990.jpg| 3| A brown and white dog stands on his hind leg and barks .;
2735158990.jpg| 4| A dog jumps in the woods .;
274616466.jpg| 0| Two young children stand at a table , looking through food that has been set out .;
274616466.jpg| 1| Two children are sitting outside at a table with popcorn all over it .;
274616466.jpg| 2| Two young children look at some type of food .;
274616466.jpg| 3| two children play with food on a table .;
274616466.jpg| 4| Two small children stand by a snack .;
2748281597.jpg| 0| A little boy with very curly hair is sitting in a blue chair with a toy in his hands .;
2748281597.jpg| 1| A young child with wild curly hair sits on a chair and shows off his Legos .;
2748281597.jpg| 2| A child with a one shirt and blue shorts is holding a toy .;
2748281597.jpg| 3| A young boy with curly blond-hair sits in a blue chair .;
2748281597.jpg| 4| A boy holding a toy while seated on a chair;
2749714328.jpg| 0| Two women both in sandals , one in a green hat is tying the other woman 's dress strap .;
2749714328.jpg| 1| A woman in a green hat is adjusting the clothing of a woman in a white sundress .;
2749714328.jpg| 2| A woman fixes her friend 's dress while out for a day in the sun .;
2749714328.jpg| 3| There are two women , and one is zipping the other one 's dress .;
2749714328.jpg| 4| One woman helps another adjust her clothing .;
2763767621.jpg| 0| Male child playing on round contained ride in the park by himself .;
2763767621.jpg| 1| A child in a red and blue hoodie is playing by himself .;
2763767621.jpg| 2| A young boy turning the wheel on a merry-go-round .;
2763767621.jpg| 3| A kid plays on a playground .;
2763767621.jpg| 4| A boy in a jacket playing .;
2766640854.jpg| 0| This simple fisherman reels in his anchor so he can start to go home as it is about to start raining judging from the overcast .;
2766640854.jpg| 1| A man is holding on to a piece of rope , sitting in an inflatable boat , in front of several other larger boats .;
2766640854.jpg| 2| Fishermen out fishing in boats , and a dog swimming in the water .;
2766640854.jpg| 3| A number of boats of varying sizes are cruising in a semi-circle .;
2766640854.jpg| 4| A man tugs on a rope in a harbor .;
2768933636.jpg| 0| The guy holding the red and white striped package is drinking from a plastic cup .;
2768933636.jpg| 1| a man drinking out of a yellow cup around people at a busy event;
2768933636.jpg| 2| A crowd is gathered in a large outdoor public space .;
2768933636.jpg| 3| A crowded commercial area in the evening .;
2768933636.jpg| 4| A man is drinking out of a yellow cup .;
2769270160.jpg| 0| A male in a black jacket and hat sitting inside an opened mailbox holding up an unidentified object .;
2769270160.jpg| 1| A man is sitting inside of a mailbox with a phone in his hand .;
2769270160.jpg| 2| A black man sitting inside a postal drop box .;
2769270160.jpg| 3| A black man sitting in a large open mailbox .;
2769270160.jpg| 4| A man is sitting in an open mailbox .;
2772831016.jpg| 0| Five people dressed in military uniform are holding guns in front of their face .;
2772831016.jpg| 1| A rifle band stands ready to perform in front of a crowd .;
2772831016.jpg| 2| Five guys in band uniforms standing in a row .;
2772831016.jpg| 3| Enlisted men putting on a performance .;
2772831016.jpg| 4| A five man drill team on stage .;
2773136618.jpg| 0| A young man with a red uniform on practicing his soccer kick .;
2773136618.jpg| 1| Person in red athletic shirt is kicking the soccer ball .;
2773136618.jpg| 2| A young man in a red uniform kicking a soccer ball .;
2773136618.jpg| 3| A young soccer player kicking a soccer ball .;
2773136618.jpg| 4| Two young men participate in a soccer game .;
2782031648.jpg| 0| In this photo there is a man in a white shirt dark blue pants standing on a small boat in what looks like a lake of some sort he has a net in one hand and a line of some type of string in the other the line is in the water the man also has a teal colored bag on his boat so he might be catching fish .;
2782031648.jpg| 1| A man fishing while standing on a small boat holding a net;
2782031648.jpg| 2| The man is fishing with a cast net on a very small boat .;
2782031648.jpg| 3| A man , standing in his skiff net fishes the waters .;
2782031648.jpg| 4| Asian fisherman standing in a boat .;
2785831737.jpg| 0| Woman stands at table under a yellow , green and blue umbrella , while child sits at table under umbrella;
2785831737.jpg| 1| A woman setting an outdoor picnic table , while young boy child sits in a camping chair .;
2785831737.jpg| 2| An umbrella shading a young woman with a small boy crouching under the table .;
2785831737.jpg| 3| A woman in pink prepares food as a child in blue sits under the table .;
2785831737.jpg| 4| A woman prepares food under a green , blue and yellow umbrella .;
2792212974.jpg| 0| A person emerges from a pool of water , the water cascading from their hair .;
2792212974.jpg| 1| A person is in the water and throwing their hair back .;
2792212974.jpg| 2| Woman 's long wet hair gives off spray in water;
2792212974.jpg| 3| A girl shakes her hair in a swimming pool .;
2792212974.jpg| 4| a woman swinging her head out of the water;
2797490755.jpg| 0| One overweight woman helps another up by offering her arm for support .;
2797490755.jpg| 1| A person with a camera holds the hand of a woman wearing a cap .;
2797490755.jpg| 2| One woman is helping another woman to her feet .;
2797490755.jpg| 3| A woman is holding onto another woman 's arm .;
2797490755.jpg| 4| A woman is being helped up .;
2798884617.jpg| 0| images are missing images are missing images are missing images are missing images are missing images are missing;
2798884617.jpg| 1| Three men and one woman are jumping into a swimming pool full of calm blue water .;
2798884617.jpg| 2| Three men and a woman caught midair jumping into a pool at a party .;
2798884617.jpg| 3| Four teenage boys are doing cannonballs into a swimming pool .;
2798884617.jpg| 4| Three guys and a girl are all jumping in a pool together .;
2807209904.jpg| 0| a group of police officers patroling the streets with a building in the background;
2807209904.jpg| 1| A group of policemen are standing outside of a building .;
2807209904.jpg| 2| A group of police officers outside a city building .;
2807209904.jpg| 3| a group of policeman in front of a glass building;
2807209904.jpg| 4| Policemen are gathered around a glass building .;
281271503.jpg| 0| Man on a tall unicycle , who is wearing bright yellow shirt , red bandanna and camouflage pants is juggling 3 pins while people watch .;
281271503.jpg| 1| A man wearing a yellow shirt riding a unicycle and juggling pins performing in front of a group of young children and some adults .;
281271503.jpg| 2| A man is riding a tall unicycle and juggling pins simultaneously while many audience members watch and applaud .;
281271503.jpg| 3| A street performer entertains a group of people by juggling bowling pins while perched on his giant unicycle .;
281271503.jpg| 4| A man in a bright yellow shirt juggles while riding a unicycle .;
2818419321.jpg| 0| An African American boy in an orange shirt is standing in a very large rock structure .;
2818419321.jpg| 1| A young boy in an orange shirt and blue jeans climbing upon some rocks .;
2818419321.jpg| 2| A young boy standing between a wall and several large boulders .;
2818419321.jpg| 3| A young boy wearing an orange shirt is playing on big rocks .;
2818419321.jpg| 4| Young boy in orange shirt walking on rocks .;
282052899.jpg| 0| closeup of bartender ( women ) grabbing a glass inside the bar .;
282052899.jpg| 1| A blond woman at a bar looks over her shoulder .;
282052899.jpg| 2| Short-haired female bartender making a drink .;
282052899.jpg| 3| A woman in a brown shirt looking down .;
282052899.jpg| 4| Women wearing black at a bar .;
2820596638.jpg| 0| An adult and a child hike through the forest with backpacks .;
2820596638.jpg| 1| A man and a boy backpack hiking through a forest .;
2820596638.jpg| 2| A man and a boy go hiking through the forest .;
2820596638.jpg| 3| Man and boy with backpacks on a hiking trail .;
2820596638.jpg| 4| Hikers walk through a forest .;
2822265828.jpg| 0| A row of young female cheerleaders sit in a row at the base of the bleachers and pose for a picture as the audience looks on .;
2822265828.jpg| 1| 19 young girls , wearing the same athletic uniform , sit next to each other on a bench facing a running track .;
2822265828.jpg| 2| Girls cheerleading team sitting on the sideline waiting to do their routine;
2822265828.jpg| 3| A cheerleading squad poses for a picture in front of full bleachers;
2822265828.jpg| 4| Young cheerleaders are sitting on a bench by a fence at a game .;
2823575468.jpg| 0| A boy in blue shorts running on a concrete surface while holding goggles .;
2823575468.jpg| 1| The young athlete completes the swimming portion of the race .;
2823575468.jpg| 2| A young boy runs barefoot while wearing a blue swimsuit .;
2823575468.jpg| 3| Boy wearing swim trunks holding goggles and running;
2823575468.jpg| 4| A wet boy carrying goggles runs .;
2825202229.jpg| 0| A photo of a piece of construction equipment with four men riding on top of it wearing hard hats and hearing protection .;
2825202229.jpg| 1| Men in hard hats working with a large gold machine doing roadwork .;
2825202229.jpg| 2| Construction workers are riding on one of their construction cars .;
2825202229.jpg| 3| Three construction workers are helping to operate a vehicle .;
2825202229.jpg| 4| Three men in hard hats are on a asphalt laying truck .;
282960970.jpg| 0| A person wearing jeans sits on top of a horse saddle .;
282960970.jpg| 1| A woman in jeans is sitting on the saddle of a horse .;
282960970.jpg| 2| The person is sitting on top of a horse .;
282960970.jpg| 3| The girl is sitting on top of a saddle .;
282960970.jpg| 4| This person is sitting in a saddle .;
2830755303.jpg| 0| A small child is running on the shore of the beach surrounded by birds .;
2830755303.jpg| 1| A child runs along the shore , while birds fly overhead .;
2830755303.jpg| 2| A young child runs along a beach as birds fly among him .;
2830755303.jpg| 3| A child running on a beach with seaguls flying around .;
2830755303.jpg| 4| a young boy wearing a gren shirt running on the beach;
2831215155.jpg| 0| An SUV is parked in a grassy field with mountains in the background , and a woman is looking through a telescope off into the distance .;
2831215155.jpg| 1| A person holding a piece of equipment up to her eyes is standing in a large meadow near a blue vehicle .;
2831215155.jpg| 2| A woman is looking through binoculars while standing in front of a car that is parked near mountains .;
2831215155.jpg| 3| A person in a field looks through a telescope while a blue car approaches or waits .;
2831215155.jpg| 4| A woman stands in a field near a car , and looks through binoculars .;
2831672255.jpg| 0| A light brown dog is walking down a blue and yellow ramp .;
2831672255.jpg| 1| A brown dog is running down a green and yellow obstacle .;
2831672255.jpg| 2| A dog running down a ramp during a dog show .;
2831672255.jpg| 3| A dog at a competition runs down a ramp .;
2831672255.jpg| 4| The dog runs down the wooden ramp .;
2833502675.jpg| 0| A man with brown hair and a green shirt is playing a trumpet .;
2833502675.jpg| 1| A brown-haired man in a green shirt plays a trumpet outdoors .;
2833502675.jpg| 2| A man in a green shirt playing the trombone .;
2833502675.jpg| 3| A man in a green shirt is playing a trumpet .;
2833502675.jpg| 4| A man is playing music with a trumpet .;
2836553263.jpg| 0| A boy with a black shirt and white shorts on a bike is turning to look behind himself .;
2836553263.jpg| 1| A boy stopped on his bike on a bike trail as a woman passes by;
2836553263.jpg| 2| A young boy with a bicycle on a road going through a forest;
2836553263.jpg| 3| A boy on his bike stops and looks back at the cameraman .;
2836553263.jpg| 4| A little boy posing on his bike , wearing a helmet .;
2836703077.jpg| 0| Two children on a carnival ride , tree in background .;
2836703077.jpg| 1| Two children riding a blue roller coaster smile .;
2836703077.jpg| 2| Two children are in a blue amusement park ride .;
2836703077.jpg| 3| Two kids ride an amusement park ride .;
2836703077.jpg| 4| two children on a ride;
2837740149.jpg| 0| Two small toddlers in shorts are swinging together in one swing on an outdoor swing set .;
2837740149.jpg| 1| Two young toddlers stuck in a children 's swing together .;
2837740149.jpg| 2| Two toddler boys sharing a baby swing at dusk .;
2837740149.jpg| 3| Two toddlers are sharing a swing .;
2837740149.jpg| 4| Two toddlers sitting on a swing .;
2837808847.jpg| 0| A brown a dog and a black dog in the edge of the ocean with a wave under them boats are on the water in the background .;
2837808847.jpg| 1| Two dogs , one brown and the other black , play in the surf in the shallow ocean water .;
2837808847.jpg| 2| Two dogs stand back to back in the ocean .;
2837808847.jpg| 3| Two dogs playing in the waves .;
2837808847.jpg| 4| two dogs play in the water .;
2838688549.jpg| 0| There are a lot of people on the beach including children .;
2838688549.jpg| 1| A sunny day at a beach with an average amount of people .;
2838688549.jpg| 2| A lot of people are at the beach on a sunny day .;
2838688549.jpg| 3| A large group of people are at a beach .;
2838688549.jpg| 4| a crowded beach full of lots of people;
2854207034.jpg| 0| There is a shopping cart and a person laying on the ground in a green field of grass .;
2854207034.jpg| 1| A person is lying on the green grass and there is a small cart next to them .;
2854207034.jpg| 2| A person lies on the grass with a shopping cart nearby .;
2854207034.jpg| 3| A man is lying on the grass next to a shopping cart .;
2854207034.jpg| 4| There is one person lying in a large , green field .;
2859661776.jpg| 0| Three white guys converse around a large grill cooking meat .;
2859661776.jpg| 1| Three men stand around an outside grill cooking hamburgers .;
2859661776.jpg| 2| Three men are having are making burgers on the grill .;
2859661776.jpg| 3| Three men cooking hamburgers on a barbecue .;
2859661776.jpg| 4| Two men watch a third man grill meat .;
2860202109.jpg| 0| A black man is wearing sunglasses and a blue shirt with a white undershirt .;
2860202109.jpg| 1| The man wearing a blue shirt has dreadlocks and sunglasses .;
