3580949553.jpg| 0| On a college campus a person in a gray shirt is laying atop a short brick wall .;
3580949553.jpg| 1| An individual is laying down on a brick wall outside next to trees .;
3580949553.jpg| 2| A young man in shorts lounging on a brick wall in a park  .;
3580949553.jpg| 3| A person taking a rest on a brick ledge .;
3580949553.jpg| 4| A girl is lying on a short brick wall .;
3583105294.jpg| 0| During a concert , a man is standing on a stage looking down at the crowd .;
3583105294.jpg| 1| A musical concert with a large number of people .;
3583105294.jpg| 2| A band is playing to a cheering crowd .;
3583105294.jpg| 3| An audience cheers at a concert .;
3583105294.jpg| 4| A rock concert is taking place .;
3584561689.jpg| 0| Basketball player makes a shot as other players to try to intercept .;
3584561689.jpg| 1| Some teenagers are scrambling for a basketball underneath the net .;
3584561689.jpg| 2| These people are playing basketball outdoors .;
3584561689.jpg| 3| two men playing basketball under a blue sky;
3584561689.jpg| 4| A group of boys play basketball together .;
3589368949.jpg| 0| Some musicians dressed in native American costume are playing traditional instruments .;
3589368949.jpg| 1| People in Native American costumes performing , banner in background .;
3589368949.jpg| 2| Indians in native dress with instruments under shelter dancing .;
3589368949.jpg| 3| Three Indians are dancing and playing musical instruments .;
3589368949.jpg| 4| A native American band plays instruments under a tent .;
359173181.jpg| 0| The brown , furry animal is walking in the snowy grass with a tree behind him .;
359173181.jpg| 1| A dog runs through snow with a big tree in the distance .;
359173181.jpg| 2| A dog runs through snow covered ground , near a tree .;
359173181.jpg| 3| Dog races through grass by lone tree .;
359173181.jpg| 4| A dog leaps through a snowy field .;
359291972.jpg| 0| A guy with a blue helmet stands on ropes above everyone else .;
359291972.jpg| 1| A man wearing a helmet while walking on ropes above the air .;
359291972.jpg| 2| A man walks on a ropes course in a helmet .;
359291972.jpg| 3| A man walking across a rope bridge .;
359291972.jpg| 4| A man walks on a rope bridge .;
3595216998.jpg| 0| A small black and white dog jumps with red plastic fence in background .;
3595216998.jpg| 1| A small , black dog jumps through the air while a person beckons it .;
3595216998.jpg| 2| A black dog leaps in the air while playing outside .;
3595216998.jpg| 3| a small black dog jumps over a bar .;
3595216998.jpg| 4| A small black dog in midair .;
3600909823.jpg| 0| A person on a skateboard is in the air while performing a skateboarding trick .;
3600909823.jpg| 1| A skateboarder does a trick on the coping of a bowl .;
3600909823.jpg| 2| A skateboarder grinds a curved bowl at night .;
3600909823.jpg| 3| A man is skateboarding on a ramp in the dark .;
3600909823.jpg| 4| A skateboarder gets to the top of a ramp .;
36032318.jpg| 0| A man in a white Bobcat scoops dirt from the ground near an athletic field .;
36032318.jpg| 1| A man working outside in a piece of machine equipment .;
36032318.jpg| 2| A man in an orange hard hat operating heavy machinery .;
36032318.jpg| 3| A construction worker is using a piece of machinery .;
36032318.jpg| 4| A Bobcat tractor scoops up some land .;
3605061440.jpg| 0| Group of children surround and pet white dog with blue collar on grass .;
3605061440.jpg| 1| Children , one with a stick , and six petting a dog with a blue leash .;
3605061440.jpg| 2| A group of children gather around a white dog on the grass outside .;
3605061440.jpg| 3| A group of children are petting a white dog on the grass .;
3605061440.jpg| 4| a group of children playing with a dog;
3610836768.jpg| 0| A group of mostly black men work together to pull a rope on the rocky shore .;
3610836768.jpg| 1| Several men are in front of a large body of water , pulling on a rope .;
3610836768.jpg| 2| A group of people committed to getting the job done in synergy .;
3610836768.jpg| 3| A group working together to pull something to shore .;
3610836768.jpg| 4| Villagers pulling in the fish boat .;
3611925069.jpg| 0| Many people are practicing in a field and a woman in a black tank top is watching a man do a high kick in the air .;
3611925069.jpg| 1| A young man shows off his karate moves to his friend .;
3611925069.jpg| 2| A boy in a white shirt is doing a kick in the air .;
3611925069.jpg| 3| A boy and a girl practicing karate in the park .;
3611925069.jpg| 4| Guy doing fighting moves .;
3612484827.jpg| 0| Two teenagers are playing wrestling game in the park .;
3612484827.jpg| 1| The guys in white shirts horse around near a park .;
3612484827.jpg| 2| A man is on the back of his friend .;
3612484827.jpg| 3| a man jumps on another man 's back .;
3612484827.jpg| 4| Two men do trick in a park .;
3614595423.jpg| 0| Several children are in a tree , laughing and with their hands on their chins .;
3614595423.jpg| 1| A bunch of kids are climbing on a tree and hamming it up .;
3614595423.jpg| 2| Eight tan children making faces in a tree;
3614595423.jpg| 3| Children posing in a tree;
3614595423.jpg| 4| Children climb a tree .;
3623036790.jpg| 0| A girl is weaving while a young child and an adult look on .;
3623036790.jpg| 1| Woman with black hair works on creating fabric .;
3623036790.jpg| 2| A mother sewing clothing for her family .;
3623036790.jpg| 3| A woman kneels before a sewing machine .;
3623036790.jpg| 4| A woman weaving on a giant loom .;
3634754655.jpg| 0| There are many people sitting or standing on sand , and there is a tractor .;
3634754655.jpg| 1| People sit and do activities in the sand around a old tractor .;
3634754655.jpg| 2| People on a beach with some construction equipment .;
3634754655.jpg| 3| A bulldozer on a beach with no water .;
3634754655.jpg| 4| A lot of people are out on a beach .;
3639105305.jpg| 0| A woman and a child are sitting on a log and stone fence with a waterfall in the background .;
3639105305.jpg| 1| A woman is sitting with a girl on a fence in front of a waterfall .;
3639105305.jpg| 2| A woman and a girl sitting on a fence in front of a waterfall;
3639105305.jpg| 3| A mother and daughter pose in front of a waterfall .;
3639105305.jpg| 4| A woman and her daughter in front of a waterfall;
3640443200.jpg| 0| A man dressed in a suit surrounded by formally dressed women with flowers;
3640443200.jpg| 1| A man posing with four girls in formal attire , probably at a wedding .;
3640443200.jpg| 2| Four bridesmaids posing dramatically with the groom .;
3640443200.jpg| 3| Groom posing with bridesmaids .;
3640443200.jpg| 4| A man in a black suit is surrounded by four women who have their hands on him .;
364282261.jpg| 0| A man in jeans and a tea shirt is scrubbing an area of the floor with a blue bucket and yellow ladder nearby .;
364282261.jpg| 1| A man using a scrub brush on a floor while crouching .;
364282261.jpg| 2| A man finishing up some floor work with a brush .;
364282261.jpg| 3| A man washes a floor next to a yellow ladder .;
364282261.jpg| 4| A man cleaning the floor in an empty room;
3643087589.jpg| 0| A small light tan dog is running past a large brown dog standing in the grass .;
3643087589.jpg| 1| The large brown dog faces the little white dog on the grass .;
3643087589.jpg| 2| A small white dog and large brown dog play on the grass .;
3643087589.jpg| 3| A large yellow dog and a small white dog in the grass .;
3643087589.jpg| 4| Two dogs playing in a yard .;
3650485497.jpg| 0| Females are painting a large grid painting of Africa and other parts of the world .;
3650485497.jpg| 1| Four young women are painting in countries of a map that is painted on a wall .;
3650485497.jpg| 2| A group of girls painting a mural of the world on a wall .;
3650485497.jpg| 3| Young women paint a large map outdoors .;
3650485497.jpg| 4| Young girls coloring a map of Africa .;
3653386313.jpg| 0| A group of officers in navy blue uniforms play brass instruments for a group of children .;
3653386313.jpg| 1| Family and friends watching a military band play a song in a building;
3653386313.jpg| 2| A group of military personnel are playing in a brass quintet .;
3653386313.jpg| 3| They are practicing for the band for the parade .;
3653386313.jpg| 4| A brass quintet is playing music .;
3654869593.jpg| 0| The children are playing a game , with a volleyball net and a football , on the beach .;
3654869593.jpg| 1| three boys play with a football near a volleyball net at the beach .;
3654869593.jpg| 2| A few young boys throwing a football over a volleyball net .;
3654869593.jpg| 3| three boys play volleyball on a busy beach .;
3654869593.jpg| 4| Boys are throwing a football on the beach .;
3658427967.jpg| 0| A boy in blue camo pants jumping into water .;
3658427967.jpg| 1| A boy in a swimsuit jumping into water .;
3658427967.jpg| 2| A boy is about to jump into the water .;
3658427967.jpg| 3| A boy jumps into the water at a beach .;
3658427967.jpg| 4| A young man leaps into the water .;
3662963630.jpg| 0| A biker leaps off a half-pipe littered with graffiti as onlookers watch .;
3662963630.jpg| 1| A cyclist airborne having jumped his bike off a graffiti covered ramp .;
3662963630.jpg| 2| A teenage boy on a bicycle is jumping off a ramp .;
3662963630.jpg| 3| A kid does a trick on a bike at a skate park .;
3662963630.jpg| 4| a bmx rider launches off a quarterpipe .;
3663905588.jpg| 0| A woman in a red dress and a man in a white suite are engaging in a ballet performance on a purple lit stage .;
3663905588.jpg| 1| A man and a woman on stage performing a dance .;
3663905588.jpg| 2| The dancing man and woman are holding a pose .;
3663905588.jpg| 3| Two people on stage performing a dance .;
3663905588.jpg| 4| Two dancers are performing on stage .;
3667157255.jpg| 0| an Olympic winner wearing her two gold medals and a gray jacket showing a peace sign and a wave;
3667157255.jpg| 1| Woman with two medals around her neck , holding up seven fingers .;
3667157255.jpg| 2| Woman wearing two gold medals holding up her hands .;
3667157255.jpg| 3| A woman wearing two medals holds up seven fingers .;
3667157255.jpg| 4| An Olympic winner takes home two medals .;
3668518431.jpg| 0| A race with motor boats and all the people are wearing red helmets and life jackets .;
3668518431.jpg| 1| Several speed boats are racing with people dressed in red aboard them .;
3668518431.jpg| 2| A group of people are out on watercraft in the middle of the ocean .;
3668518431.jpg| 3| Four powerboats racing across the sea .;
3668518431.jpg| 4| The group of boats races each other .;
3672109677.jpg| 0| A group of teenage girls do a synchronized dance in Hanna Montana costumes .;
3672109677.jpg| 1| The girls are dancing and wearing leather outfits .;
3672109677.jpg| 2| Young girls in dancing outfits perform on a stage .;
3672109677.jpg| 3| A group of girls dancing on a stage .;
3672109677.jpg| 4| Girls in a line do a dance .;
3673032164.jpg| 0| Two young girls are arm wrestling in their hotel room while another girl watches .;
3673032164.jpg| 1| Two girls arm wrestle while a third girl in a pink shirt and glasses watches .;
3673032164.jpg| 2| Two teenage girls arm wrestle while a third girl watches .;
3673032164.jpg| 3| Two girls arm wrestling , while another looks on .;
3673032164.jpg| 4| Two girls arm wrestle as another observes;
367400736.jpg| 0| Standing outside in front of a red van , a man in a hat picks up a framed painting from a table full of such paintings and other art .;
367400736.jpg| 1| A man in a straw hat and white shirt at an outdoor art gallery;
367400736.jpg| 2| A table full of pictures in frames , at an outdoor market .;
367400736.jpg| 3| A street vendor is displaying artwork and other goods .;
367400736.jpg| 4| A man in straw hat is looking at pictures on a table .;
3675345761.jpg| 0| A man with a blue shirt and glasses points to a picture in a book in front of a little girl and a stack of books .;
3675345761.jpg| 1| A man in a white shirt and tie points to an image in a children 's book while a small girl watches .;
3675345761.jpg| 2| A man in classes and a suit read a children 's book out loud to a child .;
3675345761.jpg| 3| A man reading a picture book to a child .;
3675345761.jpg| 4| A man is reading a picture book aloud .;
3677613006.jpg| 1| The girl is wearing headphones and holding a Michael Jackson album .;
3677613006.jpg| 2| a girl holding a picture of Michael Jackson smiling;
3677613006.jpg| 3| A disk jockey holds a picture of Michael Jackson .;
3677613006.jpg| 4| A female DJ holds up a Michael Jackson album .;
3677860841.jpg| 0| A young girl jumps into the deep end of a swimming pool while a young boy is nearby .;
3677860841.jpg| 1| A girl with a boy standing behind her is stepping into a swimming pool;
3677860841.jpg| 2| A boy and a girl playing in the pool on a sunny day .;
3677860841.jpg| 3| Young girl jumping into a swimming pool .;
3677860841.jpg| 4| a girl in a bikini jumps into a pool;
3680031186.jpg| 0| A Boston Red Sox baseball player holds the bat waiting for the incoming pitch .;
3680031186.jpg| 1| A player on the Boston Red Sox prepares for a pitch during a game .;
3680031186.jpg| 2| Baseball batter ready to hit the ball;
3680031186.jpg| 3| a Boston baseball player at bat;
3680031186.jpg| 4| A man is playing baseball .;
368894889.jpg| 0| A group of children running up to a sandy area to find multicolored paintings on the ground that each have a letter of the alphabet affixed .;
368894889.jpg| 1| Kids in jackets standing on sandy ground amid a scattering of large numbered pictures .;
368894889.jpg| 2| A group of children is outdoors looking at some photos that are on the ground .;
368894889.jpg| 3| A group of children look at pictures scattered on the ground .;
368894889.jpg| 4| A group of children are admiring pictures lying in the sand .;
3691394196.jpg| 0| A man in a vest and tie holding a flaming stick in a crowded area .;
3691394196.jpg| 1| A man in black and white is holding a torch in front of a crowd .;
3691394196.jpg| 2| A man doing some type of public show involving fire .;
3691394196.jpg| 3| An old man juggling fire outside a street corner .;
3691394196.jpg| 4| A man about to eat fire in the town square .;
3697359692.jpg| 0| A young boy is buckled into a car seat making a silly face .;
3697359692.jpg| 1| The young boy with a silly face is buckled in a car seat .;
3697359692.jpg| 2| A boy is sitting in a car seat in the backseat of a car .;
3697359692.jpg| 3| A boy making a face while sitting in his car seat;
3697359692.jpg| 4| A boy sitting in a car making a surprised face;
3699522388.jpg| 0| A bald man in a black wetsuit flips leaps in the air on a surfboard , holds on to a waterskiing handle;
3699522388.jpg| 1| Male performing water sports acrobatics while being pulled by a boat .;
3699522388.jpg| 2| A person waterskiing in a river with a large wall in the background .;
3699522388.jpg| 3| A wakeboarder soars through the air .;
3699522388.jpg| 4| A man doing a trick on a wakeboard;
3704709223.jpg| 0| A man in a tuxedo smiles while standing in front of a microphone and next to a man in a black hat on the electric guitar .;
3704709223.jpg| 1| A man in a tuxedo is standing on stage with a keyboard and another man with a guitar .;
3704709223.jpg| 2| Two gentlemen in tuxes play the keyboard and guitar .;
3704709223.jpg| 3| Two men in a band playing the piano and the guitar .;
3704709223.jpg| 4| A musician in clown makeup playing the guitar .;
3707649986.jpg| 0| Three handlers lead a string of 11 camels , each carrying a pair of riders , through shallow water on a beach .;
3707649986.jpg| 1| A group of people riding camels with red seat covers along a sandy shore , and three people are on foot .;
3707649986.jpg| 2| There is a herd of camels with two people riding atop each one while behind a front drop of water .;
3707649986.jpg| 3| Several camels are lined up with red blankets and people on them , on a beach .;
3707649986.jpg| 4| A group of people riding red clad camels down a beach .;
3710607005.jpg| 0| Young man with eyeglasses and goatee , wearing striped pajama pants and a blue sport 's shirt , sitting on his bed , mouth wide open .;
3710607005.jpg| 1| A man in a blue t-shirt , sitting on a bed staring at something in wonderment;
3710607005.jpg| 2| A bald man with glasses sitting on a bed in his pajamas .;
3710607005.jpg| 3| A man in pajamas is looking up at the ceiling .;
3710607005.jpg| 4| A man in a blue shirt is looking up .;
3713868971.jpg| 0| With majestic pride the horse soars over the miniature barn as the rider holds on .;
3713868971.jpg| 1| A person on a large gray horse jumping over a miniature house with a red roof .;
3713868971.jpg| 2| A white horse jumping over a hurdle that looks like a small barn .;
3713868971.jpg| 3| A woman and a horse are jumping over a miniature building .;
3713868971.jpg| 4| a horse with rider leaps over a miniature barn .;
3713922357.jpg| 0| A dirt biker in red speeds on clay road while being videotaped by a man in black .;
3713922357.jpg| 1| An off road biker is photographed as he performs another stunt in the dirt .;
3713922357.jpg| 2| A person riding on a dirt bike while someone takes a picture .;
3713922357.jpg| 3| a man wearing a red uniform rides his bicycle up a rocky hill;
3713922357.jpg| 4| The guy in red on a dirt bike is getting photographed .;
3716272233.jpg| 0| The large white bird 's reflection shows in the water .;
3716272233.jpg| 1| a white bird preparing to catch something in the water;
3716272233.jpg| 2| A white bird is flying off the water surface .;
3716272233.jpg| 3| A large white bird goes across the water;
3716272233.jpg| 4| White bird walking across wet sand .;
3718892835.jpg| 0| A boy wearing a helmet flips up his scooter as he skates between orange cones .;
3718892835.jpg| 1| A person wearing a helmet begins to fall from a silver scooter .;
3718892835.jpg| 2| A boy falls off of his scooter during an obstacle course .;
3718892835.jpg| 3| This person is falling off a scooter , in a parking lot .;
3718892835.jpg| 4| A woman is about to fall off a scooter .;
373219198.jpg| 0| A small brown dog stands on a driveway near wooden poles with his tongue sticking out .;
373219198.jpg| 1| Orange dog looks over shoulder , near posts in rural area .;
373219198.jpg| 2| The golden dog is standing by logs in a parking lot .;
373219198.jpg| 3| The light brown dog is in an uncrowded parking lot;
373219198.jpg| 4| A dog standing in a rocky area .;
3736786640.jpg| 0| Two teenage boys in black swim trunks play on a trampoline .;
3736786640.jpg| 1| Two kids in black trunks bouncing on a wet trampoline .;
3736786640.jpg| 2| Two wet boys in swim trunks are sitting on a trampoline;
3736786640.jpg| 3| Young laughing boys on a wet vinyl mat .;
3736786640.jpg| 4| Two boys are playing on a trampoline .;
3738551665.jpg| 0| A black man is talking to another man while holding a red cup in the middle of a crowd .;
3738551665.jpg| 1| A man with a red cup in his hand talking to someone on the beach .;
3738551665.jpg| 2| A man with a drink cup is talking to another man .;
3738551665.jpg| 3| Two men talk at a crowded beach on a nice day .;
3738551665.jpg| 4| Two men are having a conversation outdoors .;
3742963998.jpg| 0| A little boy in a Superman t-shirt is playing with a push toy , while the adults are standing and talking .;
3742963998.jpg| 1| A little boy wearing a superman shirt is enjoying his time at a social gathering .;
3742963998.jpg| 2| A young child having fun in his Superman shirt .;
3742963998.jpg| 3| The child in superman T-shirt is laughing .;
3742963998.jpg| 4| Blond toddler in superman shirt .;
3743976841.jpg| 0| A shot looking down at a group of girls who are dressed up and holding glasses of alcohol .;
3743976841.jpg| 1| A woman in a gray top gestures next to a woman with a knit had holding a wineglass .;
3743976841.jpg| 2| Two women who did not aim the camera at their faces .;
3743976841.jpg| 3| Two females are standing in a home .;
3743976841.jpg| 4| Two women having fun at a party .;
374437808.jpg| 0| A woman in a black shirt and a picture of another woman attached to her .;
374437808.jpg| 1| A lady holding up a picture of someone she knows at a group function .;
374437808.jpg| 2| A woman in a black shirt is holding a picture of another person .;
374437808.jpg| 3| A woman in a dark shirt holds up a photo cutout at a party .;
374437808.jpg| 4| A sad lady holds a picture up of her friend .;
3750418259.jpg| 0| A young male child , wearing light tan shorts and a bright green shirt , is feeding a snack to a zoo animal .;
3750418259.jpg| 1| A boy dressed for summer in a green shirt and kahki shorts extends food to a reindeer in a petting zoo .;
3750418259.jpg| 2| A little boy feeding a deer from the other side of a fence .;
3750418259.jpg| 3| A young boy feeding celery to a deer behind a fence .;
3750418259.jpg| 4| This child is feeding a male deer .;
3751534238.jpg| 0| A man with red shades on is holding a blowtorch while touching some type of sculpture with two onlookers .;
3751534238.jpg| 1| A man crouches in front of a sculpture while holding a blowtorch and a paintbrush .;
3751534238.jpg| 2| A man is working on a sculpture with a paintbrush and a torch .;
3751534238.jpg| 3| A father and son watch a man welding on a statue .;
3751534238.jpg| 4| A man in sunglasses is painting a sculpture .;
3751534242.jpg| 0| A man sits outside on a lawn chair using a hammer and chisel to shape a piece of wood .;
3751534242.jpg| 1| Man sitting on a chair in the fields carving a statute supported by a tree trunk .;
3751534242.jpg| 2| In this picture a black man with dreads is working on a carving .;
3751534242.jpg| 3| A man chisels a sculpture outside on a chair and log .;
3751534242.jpg| 4| A man chiseling a sculpture , possibly out of stone .;
375947808.jpg| 0| The back of a person wearing a blue hat and overalls sitting in a cart pulled by an animal .;
375947808.jpg| 1| A male wearing blue overalls , and a blue hat , rides a small house drawn carriage .;
375947808.jpg| 2| A person in blue being pulled on a buggy past a stop sign .;
375947808.jpg| 3| A person is riding in a donkey pulled cart .;
375947808.jpg| 4| A woman riding a horse buggy .;
3759492488.jpg| 0| The boy in the green shirt swings with one arm on the silver pole .;
3759492488.jpg| 1| A little kid swings on a pole at a playground .;
3759492488.jpg| 2| The boy is swinging on a pole at the beach .;
3759492488.jpg| 3| A kid in a green shirt playing in the park;
3759492488.jpg| 4| A boy hanging onto a pole .;
3759993037.jpg| 0| A small group of spectators stands on a street in front of a racing event .;
3759993037.jpg| 1| Ten people are gathered together outside of a building .;
3759993037.jpg| 2| A group of men , women , and a child at the racetrack .;
3759993037.jpg| 3| A group of people gather in front of a ticket vendor .;
3759993037.jpg| 4| People are standing and talking .;
3776965455.jpg| 0| A man and woman , each wearing a white shirt , are walking down the sidewalk while talking on their phones .;
3776965455.jpg| 1| A couple wearing white shirts are walking down the street while using their cellphones .;
3776965455.jpg| 2| A man with a white shirt and a woman with a white shirt are talking on their phones .;
3776965455.jpg| 3| Two people with white shirts walking up the sidewalk talking on their phones .;
3776965455.jpg| 4| The couple is walking down the street talking on their cellphones .;
3787061402.jpg| 0| A boy sits behind two children in a grassy park and touches another boys ears .;
3787061402.jpg| 1| A boy is pulling the ears of his friend who sits in front of him .;
3787061402.jpg| 2| A young boy pulls on both of another young boy 's ears .;
3787061402.jpg| 3| An older boy holding the ears of a younger boy .;
3787061402.jpg| 4| A young boy holds another boy 's ears .;
3796854356.jpg| 0| Two people are walking down a path in the forest preserves .;
3796854356.jpg| 1| Two people are walking on a trail through the woods .;
3796854356.jpg| 2| An older man and a woman walk along a forest path .;
3796854356.jpg| 3| Two people are walking down an isolated road .;
3796854356.jpg| 4| A man and a woman are walking on a dirt road .;
3827245354.jpg| 0| A man wearing a black sweater and a knit cap sits in front of mountain scenery , with a cloudy sky overhead .;
3827245354.jpg| 1| This man in a red hat is sitting at the top of a mountain on a sunny day .;
3827245354.jpg| 2| A man is sitting down with mountains in the background .;
3827245354.jpg| 3| Man in a black sweater sitting on a mountainside .;
3827245354.jpg| 4| A man sitting on a beautiful mountaintop .;
3840834941.jpg| 0| A woman with a green and white shirt , and brownish hair , is at a place that , as said on a sign there , has a restaurant , cocktails , and a water view .;
3840834941.jpg| 1| A picture of two employees at a market taking orders from the shoppers .;
3840834941.jpg| 2| A woman is ordering food from a market and being served by two women .;
3840834941.jpg| 3| two women ordering grains at a street shot .;
3840834941.jpg| 4| Two ladies buying from a market .;
384577800.jpg| 0| A Sheltie dog carries a white-colored toy in its mouth as it walks across the snow .;
384577800.jpg| 1| A brown dog carries an object in its mouth on a snowy hillside .;
384577800.jpg| 2| The dog wades through deep snow with something in its mouth .;
384577800.jpg| 3| A collie running through the snow .;
384577800.jpg| 4| Dog with a toy in the snow .;
384594338.jpg| 0| Two people with one parachute skydiving in white and orange jumpsuits .;
384594338.jpg| 1| Two skydivers in jumpsuits and parachute gear smile while diving .;
384594338.jpg| 2| Two men in orange and white jumpsuits are free falling .;
384594338.jpg| 3| Two men in white and orange jumpsuits skydiving .;
384594338.jpg| 4| Man and woman enjoying a skydive .;
