4774980820.jpg| 1| A man and a woman both dressed completely in white share a kiss on a beach .;
4774980820.jpg| 2| A young couple wearing all white having a romantic evening on the beach .;
4774980820.jpg| 3| a woman and a man , outside , enjoying each others company .;
4774980820.jpg| 4| Couple in white kissing on beach .;
4781019036.jpg| 0| A group of men and women are in the carnival ride .;
4781019036.jpg| 1| People brace themselves on a carnival ride .;
4781019036.jpg| 2| Young riders on an amusement park ride .;
4781019036.jpg| 3| Kids on a ride at an amusement park .;
4781019036.jpg| 4| Six people riding a roller coaster .;
4781282778.jpg| 0| Old world stone houses and streets look lovely in the background , and faint person can be seen walking .;
4781282778.jpg| 1| Flowers growing out of a brick wall in an old city next to a road that some people are walking down .;
4781282778.jpg| 2| A woman in a red shirt is walking with others along a road .;
4781282778.jpg| 3| A couple walking toward a planter of beautiful flowers .;
4781282778.jpg| 4| People strolling outside near a brick building .;
4788507034.jpg| 0| An older man with thin white hair , a beard , and glasses is wearing a white muscle shirt and vest while waiting by the tennis court .;
4788507034.jpg| 1| An unkempt frowning old man with white hair is sitting in front of a chain-linked fence .;
4788507034.jpg| 2| An elderly man wearing a tan shirt is sitting next to a tennis court .;
4788507034.jpg| 3| An elderly man wearing a watch a sleeveless shirt looking forward .;
4788507034.jpg| 4| Old man sitting near a metal fence outside looking towards a car .;
4789959232.jpg| 0| Male in the street wearing a blue plaid shirt waiting for the light to turn .;
4789959232.jpg| 1| A middle-aged man standing in the middle of a crowd looking the other way .;
4789959232.jpg| 2| A man is standing on a busy street looking with his head tilted up .;
4789959232.jpg| 3| Man with plaid shirt staring off into the distance .;
4789959232.jpg| 4| A man in a blue plaid shirt looking up .;
4795708965.jpg| 0| A barricade separates two women and three children from a group of men in uniform marching down the road .;
4795708965.jpg| 1| A lady in a purple top and a white skirt is watching a marching parade .;
4795708965.jpg| 2| A procession is marching on the street while people are watching .;
4795708965.jpg| 3| Young families watch a military procession in a parade .;
4795708965.jpg| 4| Onlookers watch as a parade goes by with soldiers .;
4797124142.jpg| 0| A man wearing a hat has his eyes closed , as another man in a red shirt is licking his face .;
4797124142.jpg| 1| One man is licking another man 's chin in front of a crowd of people .;
4797124142.jpg| 2| A man in a red tank top licking the face of another man .;
4797124142.jpg| 3| One man wearing a red shirt is kissing another man .;
4797124142.jpg| 4| A man is licking the face of another man .;
4797654743.jpg| 0| Woman walking alone down country road looks back over her shoulder .;
4797654743.jpg| 1| A woman with long hair and a white shirt is standing in the road .;
4797654743.jpg| 2| A girl stands on a tree lined road during sunset .;
4797654743.jpg| 3| A girl stands on a gravel road as the sun sets .;
4797654743.jpg| 4| A woman is standing on a road .;
480845172.jpg| 0| A child is holding their parent 's hand while walking in a forrest .;
480845172.jpg| 1| A mother and son are about to embark on a forest adventure .;
480845172.jpg| 2| An adult and a child holding hands on a path in the woods .;
480845172.jpg| 3| A child and a parent or older sibling going for a hike .;
480845172.jpg| 4| Two people take a walk down a wooded trail .;
4810150528.jpg| 0| An older couple shares a loving moment leaning over a railing overlooking the ocean .;
4810150528.jpg| 1| An elderly couple enjoy some time alone on the boardwalk overlooking the ocean .;
4810150528.jpg| 2| A man and woman stand at a railing looking across a vast water body .;
4810150528.jpg| 3| A couple gazing out into the ocean from a bridge .;
4810150528.jpg| 4| This is a couple in love .;
4811469218.jpg| 0| A woman in revealing clothes who wears a black hat and sunglasses walks down a busy street .;
4811469218.jpg| 1| A woman in a bathing suit and shorts walking down the street in a black hat and sunglasses .;
4811469218.jpg| 2| A lady in a black hat and glasses walks down the street in front of a crowd of people .;
4811469218.jpg| 3| A woman with long black hair wearing a black hat and black top with jean shorts on .;
4811469218.jpg| 4| Amy Winehouse wanna be look alike .;
4816563536.jpg| 0| Three people laying on a beach together staring out at the ocean .;
4816563536.jpg| 1| 3 young people watching the waves splash on the beach shore .;
4816563536.jpg| 2| Two women and a man looking at the wave in the ocean .;
4816563536.jpg| 3| Three ladies lay on a beach facing the ocean .;
4816563536.jpg| 4| Three people are laying on a beach .;
4818426478.jpg| 0| A group of people stand on the sidewalk in front of a Gap store , all of the men are wearing blue shirts .;
4818426478.jpg| 1| People outside the GAP store on a brick walkway while one man in jeans takes a picture .;
4818426478.jpg| 2| A crowd of people is looking at something outside of a Gap store .;
4818426478.jpg| 3| A small group of people in front of a Gap store taking pictures .;
4818426478.jpg| 4| A group of people taking pictures .;
4823873791.jpg| 0| A woman wearing a blue skirt and white tank top examines a makeup counter in a store .;
4823873791.jpg| 1| A woman in a white top and blue skirt looking at makeup .;
4823873791.jpg| 2| A woman in a blue skirt browsing cosmetics at a store .;
4823873791.jpg| 3| Woman in heels and skirt looking at products .;
4823873791.jpg| 4| A woman is choosing a perfume;
4823948097.jpg| 0| A group of Asian men are sitting or standing around a small square table .;
4823948097.jpg| 1| Some Asian men are sitting while others are standing around .;
4823948097.jpg| 2| Eight men gathered around a table at night .;
4823948097.jpg| 3| A group of men are sitting around a table .;
4823948097.jpg| 4| A group of Asian men are playing a game .;
4824627321.jpg| 0| A group of people are working in a room using batteries , wires , and computers .;
4824627321.jpg| 1| A person sitting in front of a laptop and many electrical parts .;
4824627321.jpg| 2| A room of young adults are using computer and read books .;
4824627321.jpg| 3| Young workers in a lab are working on electronics .;
4824627321.jpg| 4| Coworkers are working on a projects at tables .;
4825488431.jpg| 0| Silver plane in a blue sky , ready to land with its wheels down , while spectators watch behind a high fence .;
4825488431.jpg| 1| An airplane flying over a fence with a few bystanders watching it as it approaches its landing .;
4825488431.jpg| 2| Group of people stand near a fence watching a plane fly over them;
4825488431.jpg| 3| People watch as a plane flies over their heads at an airfield .;
4825488431.jpg| 4| A group of people are watching a plane flying low .;
4830857471.jpg| 0| A woman wiping the brow of another woman , sitting down amongst a crowd of woman , drinking from a bottle .;
4830857471.jpg| 1| A girl in a white shirt holds a towel over another girls face as she drinks from a cup in a crowded place .;
4830857471.jpg| 2| Woman presses cloth to forehead of second woman drinking a glass of water while third woman observes .;
4830857471.jpg| 3| A girl sitting down drinking water surrounded by girls helping her feeling better .;
4830857471.jpg| 4| A girl is cooling off and hydrating .;
4837491077.jpg| 0| A man stands on a transportation platform with earphones and a handheld electronic device .;
4837491077.jpg| 1| A man in a pink shirt is listening to his iPad while he waits for the train .;
4837491077.jpg| 2| A man wearing headphones and a pinkish shirt looking at his notebook .;
4837491077.jpg| 3| Young professional man using his notebook phone at a subway platform .;
4837491077.jpg| 4| A man wearing a pink shirt has headphones on .;
484093882.jpg| 0| A man in a white shirt , dark shorts and a red cap is standing in a small green rowboat with green oars , in the middle of what appears to be a shallow river , against a bank of tall dried grasses .;
484093882.jpg| 1| Red capped male dressed in white shirt and dark shorts is standing on small green boat located water in tall grassy bank .;
484093882.jpg| 2| Older fisherman is rowing a green boat standing up down a calm river .;
484093882.jpg| 3| A man in a red hat is standing up in a rowboat with green paddles .;
484093882.jpg| 4| An elderly man stands in a rowboat on a body of water .;
4842516865.jpg| 0| A man in a dark green shirt is splitting wood next to a tree .;
4842516865.jpg| 1| An older man chops wood beside a large tree in a field .;
4842516865.jpg| 2| A man chops wood near a large tree trunk .;
4842516865.jpg| 3| An older gentleman chops wood by a tree .;
4842516865.jpg| 4| A man is chopping wood with an ax .;
4846306430.jpg| 0| A woman lies naked , wrapped in a net on top of a rock by the ocean .;
4846306430.jpg| 1| A naked man wrapped in a net lying on some rocks on the oceanside .;
4846306430.jpg| 2| A naked man in a net is curled up asleep on a scenic mountaintop .;
4846306430.jpg| 3| A naked man lies on the rocks near the water trapped in a net .;
4846306430.jpg| 4| Naked man lying on rocks under a net .;
4846544688.jpg| 0| A man wearing nothing but a cloth around his waist is standing , facing a crowd with a bright red substance on his back .;
4846544688.jpg| 1| A man in traditional garb is bleeding from cuts on his back .;
4846544688.jpg| 2| A man shows hi back that is covered in cuts and bleeding .;
4846544688.jpg| 3| We can see blood at the back of this man;
4846544688.jpg| 4| A man 's cut and bloody back .;
4849118892.jpg| 0| A man with short brown hair wearing a red shirt is sitting outdoors next to a woman wearing a black and white blouse .;
4849118892.jpg| 1| A man and a squinting woman are looking at something on a screen .;
4849118892.jpg| 2| A woman and two men unhappily look at something .;
4849118892.jpg| 3| A man and woman are seen looking at a monitor .;
4849118892.jpg| 4| A woman frowns and looks into the distance .;
4853218641.jpg| 0| A young teenage girl talking to her boyfriend on the phone about moving into another city;
4853218641.jpg| 1| A woman wearing a very short dress standing up with her cellphone to her ear .;
4853218641.jpg| 2| A woman wearing an attractive black shiny dress talks on a cellphone .;
4853218641.jpg| 3| A lady in a black shimmery dress talking on cellphone .;
4853218641.jpg| 4| A woman in a dress is talking on the phone .;
4858197102.jpg| 0| A man wearing a blue t-shirt and shorts is holding a newborn baby who is yawning .;
4858197102.jpg| 1| A man with brown hair and a blue shirt is holding a baby with its mouth open .;
4858197102.jpg| 2| A new father is holding his yawning newborn in the hospital .;
4858197102.jpg| 3| Man holding crying baby in chair near window .;
4858197102.jpg| 4| A man holding a newborn baby .;
4860278774.jpg| 0| a woman riding a tan horse with a white mane around a rodeo arena .;
4860278774.jpg| 1| A female cowgirl riding a horse , at a ranch .;
4860278774.jpg| 2| A person in a cowboy hat rides a tan horse .;
4860278774.jpg| 3| A woman is riding a palomino horse .;
4860278774.jpg| 4| A cowboy riding a horse in a ring .;
4860408066.jpg| 0| A woman and a man with tattoos on the upper area of both of his arms having fun on the sidewalk with a few streamers around them .;
4860408066.jpg| 1| A girl with blond-hair is connected to ribbons of many colors and is enjoying some sort of celebration .;
4860408066.jpg| 2| A woman wearing a yellow t-shirt laughs while being entwined in pink white and teal streamers .;
4860408066.jpg| 3| Several women are wrapping themselves up in pink , blue and white ribbon .;
4860408066.jpg| 4| Girl tangled in multicolored bands on tracks .;
4861707754.jpg| 0| A man with shoulder length dark hair sits near the rocks of a waterfront while holding a cigarette in his right hand .;
4861707754.jpg| 1| On a sunny day , a man sits on rocks smoking beside a body of water .;
4861707754.jpg| 2| A man is smoking by the beach while boats sail in the distance .;
4861707754.jpg| 3| A man smokes a cigarette on rocks by the beach .;
4861707754.jpg| 4| A person sitting near the beach .;
4863764261.jpg| 0| Man in a white t-shirt , smoking a cigarette , sitting in front of a red door .;
4863764261.jpg| 1| A man sitting on a step in front of a red door smoking .;
4863764261.jpg| 2| A man in black sneakers is sitting and smoking .;
4863764261.jpg| 3| A asian man smoking on porch .;
4863764261.jpg| 4| A man sitting on a step .;
4863792636.jpg| 0| In a street in japan traditional and modern styles of clothing can both be seen .;
4863792636.jpg| 1| A city street scene adorned with people and rooftops .;
4863792636.jpg| 2| A crowd in a daily routine in an Asian suburb .;
4863792636.jpg| 3| People are walking on a crowded street .;
4863792636.jpg| 4| People roaming the street .;
4872377897.jpg| 0| A woman in a University of Rottingham hoodie playing with a little boy in a blue and white shirt .;
4872377897.jpg| 1| A woman in a University of Nottingham hoodie playing with a boy outside .;
4872377897.jpg| 2| A woman in a University of Nottingham sweater playing with a child .;
4872377897.jpg| 3| A woman swings a child in front of some houses and a large hill .;
4872377897.jpg| 4| A woman swinging a child around .;
4872391001.jpg| 0| An amorous couple with water in front of them , an old building with ornate pillars in the background .;
4872391001.jpg| 1| A couple is sitting in front of a landmark sharing an intimate kiss with their feet resting in water .;
4872391001.jpg| 2| A man and a woman being intimate , with their legs in the water .;
4872391001.jpg| 3| a man and a woman are about to kiss;
4872391001.jpg| 4| A couple about to kiss somewhere .;
4873970424.jpg| 0| A young man smiles and points at something off-camera , while standing in front of a display .;
4873970424.jpg| 1| A woman wearing a black shirt is pointing to glass that has the word Utiah written on it .;
4873970424.jpg| 2| A museum guide describing an exhibit to some tourists .;
4873970424.jpg| 3| A black man is pointing at a sign .;
4873970424.jpg| 4| A woman selling ethnic goods .;
4875054703.jpg| 0| A flower vendor in purple stands in front of his flowers with his arm stretched out with many people around .;
4875054703.jpg| 1| A man wearing a blue tank top in front of a truck with flower pots in front of it .;
4875054703.jpg| 2| A man pointing in a direction while other people look on .;
4875054703.jpg| 3| A man uncovering a truck full of flower pots .;
4875054703.jpg| 4| A vendor sells plants at an outdoor market .;
4876043682.jpg| 0| A boy in a yellow t-shirt and pink sweater talks on a cellphone while riding a horse through a crowd of people who are looking on .;
4876043682.jpg| 1| A young man is riding a horse through a group of people while he talks on his cellphone .;
4876043682.jpg| 2| A boy rides on a camel in a crowded area while talking on his cellphone .;
4876043682.jpg| 3| A boy talks on his cellphone , while riding a horse through an event .;
4876043682.jpg| 4| A young man is talking on a phone while riding a horse .;
4879085576.jpg| 0| Two men in a village in India are playing stick ball .;
4879085576.jpg| 1| Two men play a game with a wooden stick and a ball .;
4879085576.jpg| 2| Two men are playing stick ball in a green valley .;
4879085576.jpg| 3| Southeast Asian men play a game of cricket .;
4879085576.jpg| 4| Two men playing a game of baseball .;
488416045.jpg| 0| A brown dog wearing a black collar running across the beach .;
488416045.jpg| 1| The large brown dog is running on the beach by the ocean .;
488416045.jpg| 2| A dog walks on the sand near the water .;
488416045.jpg| 3| A brown dog is running along a beach .;
488416045.jpg| 4| Brown dog running on the beach .;
4890769146.jpg| 0| Four adults and a little blond girl walk up a set of outside stairs lead by a lady in a pink shirt .;
4890769146.jpg| 1| Five people walking up a set of stairs led by a woman in a pink shirt and brown skirt .;
4890769146.jpg| 2| A group of people walking up stairs surrounded by buildings covered in graffiti .;
4890769146.jpg| 3| A woman wearing a p blouse walks up a flight of stairs .;
4890769146.jpg| 4| People climbing up stairs with graffiti behind them .;
4894954666.jpg| 0| A couple takes pictures in the park as others stroll by and enjoy the area .;
4894954666.jpg| 1| A man and a woman stop to take a picture in an outdoor setting .;
4894954666.jpg| 2| Hanging out at the park , couple stops to take some pictures .;
4894954666.jpg| 3| A man and woman take pictures on a street corner .;
4894954666.jpg| 4| Two people squat down and take pictures .;
4897380068.jpg| 0| A group of seven girls wearing ethnic dress are lined up outside at a fair .;
4897380068.jpg| 1| Seven girls are standing in a line to play at the park;
4897380068.jpg| 2| Seven kids are standing outside on a sidewalk .;
4897380068.jpg| 3| seven children in skirt standing in a line;
4897380068.jpg| 4| A group of children standing in line .;
4897972073.jpg| 0| There is an elderly dancer wearing a purple and gold colored costume that has light brown skin and dark , curly hair .;
4897972073.jpg| 1| A woman dress in all pink and gold staring at something .;
4897972073.jpg| 2| A person in pink dancing and twirling .;
4897972073.jpg| 3| A woman covered in a hot pink fabric .;
4897972073.jpg| 4| African women in a pink headdress .;
490044494.jpg| 0| Three tan and brown dogs are running over grass .;
490044494.jpg| 1| Three small puppies run through the green grass .;
490044494.jpg| 2| Three brown puppies running in the grass .;
490044494.jpg| 3| Three dogs are running through the grass .;
490044494.jpg| 4| Three dogs run through a field .;
4900546628.jpg| 0| Two young men , one standing before a microphone and one sitting and drinking from a cup , are on stage , along with two paintings , a white screen , a lamp , and an Apple laptop .;
4900546628.jpg| 1| One man wearing glasses sits in front of an Apple computer and drinks from a cup while another man wearing a cap and glasses stands in front of a microphone .;
4900546628.jpg| 2| Two men in front of a projector screen , one at a microphone .;
4900546628.jpg| 3| guy doing his dubbing and the director drinking his beverage;
4900546628.jpg| 4| Two men are on stage giving some sort of presentation .;
4900663691.jpg| 0| Two men are sitting on their bags while other people walk in the background .;
4900663691.jpg| 1| Men sitting and sleeping on the street on their bags .;
4900663691.jpg| 2| two men on a sidewalk sitting and lying on luggage .;
4900663691.jpg| 3| Men are sitting on bags on the ground .;
4900663691.jpg| 4| 2 men rest on their baggage .;
490390951.jpg| 0| A person wearing gray converse shoes took a picture of the water barely touching their shoes .;
490390951.jpg| 1| A person wearing gray tennis shoes is standing right where the waves stop on the sand .;
490390951.jpg| 2| a closeup of gray and white shoes on the shore near the beach water .;
490390951.jpg| 3| The person wearing tennis shoes is standing on the sand .;
490390951.jpg| 4| A shot of shoes in water .;
4910842410.jpg| 0| People walking through the park some staring at the fountain , and a couple holding hands .;
4910842410.jpg| 1| People are walking in a park with manicured hedges along the walkway .;
4910842410.jpg| 2| A man and woman are holding hands as they walk down the street .;
4910842410.jpg| 3| Pedestrians stroll down gardened walkway .;
4910842410.jpg| 4| A busy outdoor park in europe .;
4912674510.jpg| 0| A mature lady in a red sweater is laying in the grass with some bunnies .;
4912674510.jpg| 1| A woman in a red sweater is sitting on grass and watching rabbits .;
4912674510.jpg| 2| A woman in a red shirt sitting in the grass feeding rabbits .;
4912674510.jpg| 3| A woman in a red coat is sitting in the grass with rabbits .;
4912674510.jpg| 4| A woman is laying on the grass with rabbits .;
4913033344.jpg| 0| Four cute elderly lady friends are waiting together on a bench under a large tree , and a younger woman with blond curls and yellow skirt sits off to the side .;
4913033344.jpg| 1| One younger looking woman sitting on the opposite side of a bench from a group of 4 older women .;
4913033344.jpg| 2| Five women sit on a long bench in front of a large tree and wooden door .;
4913033344.jpg| 3| a woman and old ladies sitting on a bench;
4913033344.jpg| 4| Five women sitting on a bench .;
491321888.jpg| 0| A young man dressed in a dark bathing suit exits from a swimming pool while water drips off his head and body .;
491321888.jpg| 1| A guy in a black swimsuit getting out of the pool at a hotel .;
491321888.jpg| 2| Young man getting out on the side of a public swimming pool .;
491321888.jpg| 3| A male in black shorts is climbing out of a pool .;
491321888.jpg| 4| A white male exiting the pool for the restroom .;
4917188600.jpg| 0| Three street performers play and sing in the streets , one is playing an accordion , and the other two sing , as people walk past .;
4917188600.jpg| 1| An older woman and man in uniform stand in front of a music podium while an accordion player plays nearby .;
4917188600.jpg| 2| An old man and lady in a white uniform is standing next to a man in black playing an instrument .;
4917188600.jpg| 3| Three people dressed up playing music on a sidewalk .;
4917188600.jpg| 4| Elderly people performing music in a street .;
4920970731.jpg| 0| Man in a black hat sits with a female in a pink shirt and jean shorts in an amphitheater in the city .;
4920970731.jpg| 1| A man and a woman are sitting outside with large building surrounding them .;
4920970731.jpg| 2| A woman and a man sit on a stone bench , with tall buildings behind them .;
4920970731.jpg| 3| A girl in a pink tank top and her boyfriend sitting on stone steps .;
4920970731.jpg| 4| a couple sitting on a bench next to a building;
4923472130.jpg| 0| A man sits alone in front of a building , hanging his head so low it appears to not exist .;
4923472130.jpg| 1| A man sitting on the sidewalk photographed at an angle that makes him look headless .;
4923472130.jpg| 2| A person in a red shirt and black pants hunched over .;
4923472130.jpg| 3| A man in a red shirt and black pants is sitting down .;
4923472130.jpg| 4| A man is tying his shoe lace .;
4923755473.jpg| 0| A man wearing a long-sleeved gray shirt and dark pants is walking through a gray stone archway .;
4923755473.jpg| 1| This path leads up to the apple market entrance .;
4923755473.jpg| 2| A man is walking through an older archway .;
4923755473.jpg| 3| A man walks through a pathway .;
4923755473.jpg| 4| A man walks though an arch .;
4933367985.jpg| 0| A man gives his son company as his son enjoys the Wiggle 's Big red car .;
4933367985.jpg| 1| A child enjoying a ride on a Wiggles car while his father looks on .;
4933367985.jpg| 2| The man is next to the toy car watching his son have fun .;
4933367985.jpg| 3| A child plays in a Wiggles car while a man watches .;
4933367985.jpg| 4| A man watching a child ride an amusement ride .;
4935761859.jpg| 0| The sun sets on a commercial city street that is being lit by the glows emanating from the shops .;
4935761859.jpg| 1| Two men and a woman stroll down the city street past storefronts .;
4935761859.jpg| 2| Young people are walking on the street in the evening .;
4935761859.jpg| 3| People walking down a city street at dusk .;
4935761859.jpg| 4| four people walking on a strip;
4937201390.jpg| 0| Several figures stand outdoors on the top of a flight of steps , one of whom is holding a yellow parasol with blue trim .;
4937201390.jpg| 1| A group of people , one holding a yellow and blue umbrella , are standing at the top of some stairs .;
4937201390.jpg| 2| A group of people standing at the top of a flight of steps outdoors .;
4937201390.jpg| 3| A group of people stand on wet stairs with two trees behind them .;
4937201390.jpg| 4| A group of people are standing on steps in front of a building .;
49402821.jpg| 0| A little girl in a salmon skirt attempting to hit a soccer ball but missing .;
49402821.jpg| 1| Young girl kicking around soccer balls on a large soccer field .;
49402821.jpg| 2| A little girl kicking a soccer ball in a soccer stadium .;
49402821.jpg| 3| A little girl kicks a ball in front of a soccer net .;
49402821.jpg| 4| A little girl is kicking a soccer ball .;
4941418090.jpg| 0| A female musician tunes her acoustic guitar while smiling at the camera .;
4941418090.jpg| 1| The lady with the pink top is playing the guitar outside a shop window .;
4941418090.jpg| 2| A woman in a pink flowered shirt playing a guitar and smiling .;
4941418090.jpg| 3| this lady is wearing a pink shirt and tuning her guitar;
4941418090.jpg| 4| A woman playing a guitar .;
4943870853.jpg| 0| People sitting on a curb in front of a building with asian writing on it .;
4943870853.jpg| 1| Three men sitting on the curb in front of a convenience store .;
4943870853.jpg| 2| Three people sitting on a street corner looking tired .;
4943870853.jpg| 3| Three people sitting on the curb in an Asian city .;
4943870853.jpg| 4| People sitting on the curb in Asia .;
4946023775.jpg| 0| A group of people who are dressed nicely are relaxing together on green grass .;
4946023775.jpg| 1| Five adults in suits and dresses take a nap on a public piece of grass .;
4946023775.jpg| 2| Several people wearing formal clothes are sleeping together on grass .;
4946023775.jpg| 3| 3 men in tuxedos and 2 women in dresses , sleeping on the grass .;
4946023775.jpg| 4| Five young adults are resting on the grass .;
