4815358491.jpg| 1| Four small kids dress in black and red wedding attire play on the floor .;
4815358491.jpg| 2| Children wearing red formal attire act silly together .;
4815358491.jpg| 3| Two girls in red dresses and two boys in suits play .;
4815358491.jpg| 4| a small family at a wedding .;
4817228819.jpg| 0| A taxi driver rests one of his hands on his forehead and another on the head of the passenger seat .;
4817228819.jpg| 1| Man sitting in yellow car in the sun , wiping forehead .;
4817228819.jpg| 2| A man in a yellow car has his hand to his forehead .;
4817228819.jpg| 3| A taxi cab driver looks stressed out in his car .;
4817228819.jpg| 4| A man in a yellow car covering his face .;
4821810079.jpg| 0| A man in a red shirt is walking towards a blue market stall .;
4821810079.jpg| 1| A man in a red vest is holding a red article of clothing .;
4821810079.jpg| 2| A man in a red shirt holding a red piece of clothing .;
4821810079.jpg| 3| A man dressed in red is at the marketplace .;
4821810079.jpg| 4| A man is wearing a red shirt and vest .;
4822402043.jpg| 0| Senior citizen with blue shirt and blue pants standing outdoors with hands behind his back .;
4822402043.jpg| 1| An old man wearing a blue shirt is standing against a wall .;
4822402043.jpg| 2| An elderly man poses in a blue shirt and shorts .;
4822402043.jpg| 3| A man dressed in blue stands against a wall .;
4822402043.jpg| 4| A man in a blue shirt looks irritated .;
482315006.jpg| 0| A man and a woman are lying together on a grassy park field near a waterfront .;
482315006.jpg| 1| A man and a woman are relaxing on the grass in front of a body of water .;
482315006.jpg| 2| A couple relax on a patch of grass with a body of water behind them .;
482315006.jpg| 3| man and a barefoot woman lying on the grass by water snuggling .;
482315006.jpg| 4| Couple laying in the grass by water .;
4825833751.jpg| 0| An elderly bald man at a street corner plays a violin , apparently busking while sitting on a folding chair .;
4825833751.jpg| 1| An older man sitting on a stool on the sidewalk playing a violin .;
4825833751.jpg| 2| A man in a white shirt a dark tan pants plays a violin outside .;
4825833751.jpg| 3| An older man is playing a violin on the street .;
4825833751.jpg| 4| A man playing the violin in the street .;
4827958485.jpg| 0| A musician with a guitar on stage in front of a microphone gesturing to the crowd with the drummer in the background .;
4827958485.jpg| 1| A man standing on a stage playing a guitar and a harmonica waving to the crowd .;
4827958485.jpg| 2| The man is talking into the microphone while playing the guitar .;
4827958485.jpg| 3| A man with black hair and a guitar waves while on stage .;
4827958485.jpg| 4| A man with a guitar is waving .;
482830610.jpg| 0| Woman on a train , reading and listening to headphones .;
482830610.jpg| 1| The girl is sitting on a train and reading a book .;
482830610.jpg| 2| A woman reads while on public transportation .;
482830610.jpg| 3| A girl reads and listens to music on a bus .;
482830610.jpg| 4| a woman reads a book on a train .;
482907079.jpg| 0| A figure is climbing up a rock while people on the grond watch .;
482907079.jpg| 1| A person climbs a cliff face in the woods while others watch .;
482907079.jpg| 2| People are watching a man who is climbing on a rock face .;
482907079.jpg| 3| A climber scales a cliff as others watch .;
482907079.jpg| 4| A woman is rock climbing;
4829255593.jpg| 0| A man with a brownish purple shirt and jeans is holding a large banana in one hand and his son 's hand in his other .;
4829255593.jpg| 1| A man with a giant banana and a little boy with a cowboy hat walking in a crowded area .;
4829255593.jpg| 2| A man carrying a giant banana toy walks in street fair with toddler holding his hand .;
4829255593.jpg| 3| A man holds his son 's hand in his right and a large stuffed banana in his left .;
4829255593.jpg| 4| An adult and a child are walking around some sort of festival .;
4830850373.jpg| 0| A man with a hiking equipment is tying his shoe in the woods .;
4830850373.jpg| 1| A man wearing a backpack tying his shoe on a hiking trail .;
4830850373.jpg| 2| A hiker stops on the trail in a forest to tie his shoe .;
4830850373.jpg| 3| A man tying his shoe in the forest .;
4830850373.jpg| 4| Man in hiking gear tying his shoe .;
4834129930.jpg| 0| A man sitting indian style in front of a ground painting , there are two men and a woman sitting on the curb in front of him and the picture .;
4834129930.jpg| 1| Two men and a woman sit on a sidewalk and watch an artist draw a detailed picture on the ground .;
4834129930.jpg| 2| A group of artists smoke cigarettes and sketch chalk drawings on the streets .;
4834129930.jpg| 3| Three people watch a fourth draw a chalk portrait on the street .;
4834129930.jpg| 4| One dog playing with a blond girl .;
4837948080.jpg| 0| An Asian schoolgirl in a typical schoolgirl uniform , dark pullover , plaid skirt , and knee socks with penny loafers .;
4837948080.jpg| 1| A young Asian girl is wearing a school uniform and standing in a market setting looking for someone .;
4837948080.jpg| 2| A young Asian women in a uniform stands with a green bag in a market .;
4837948080.jpg| 3| Asian schoolgirl carrying her bags and a musical instrument .;
4837948080.jpg| 4| A girl standing in a skirt and black shoes .;
4838244073.jpg| 0| A woman in a green shirt is working within a large amount of vegetation that is at different stages of maturity .;
4838244073.jpg| 1| A woman in a green shirt is interacting with tomato plants .;
4838244073.jpg| 2| An African American woman is picking tomatoes in a garden .;
4838244073.jpg| 3| A woman in a green shirt stands in a field of produce .;
4838244073.jpg| 4| African american woman working in a garden .;
4845542946.jpg| 0| A group of young black men smiling wearing white shirts black pants and blue jeans sitting and standing in front of a store posing with their hands and thumbs up for the camera .;
4845542946.jpg| 1| Three men in white shirts are posing for a picture outside of a local store .;
4845542946.jpg| 2| Three african american men hang around a store together .;
4845542946.jpg| 3| A group of three black men in jeans pose for the camera .;
4845542946.jpg| 4| Three men are standing around happily .;
4846324908.jpg| 0| Three people , two in black and one in yellow , are seated on a wooden bench , only their heads and shoulders visible , in front of a sign for a furniture showroom & restaurant .;
4846324908.jpg| 1| The lady wearing black rimmed glasses and a yellow sweater jacket looks confused as she sits on the tan covered bench .;
4846324908.jpg| 2| Two women talking to one another while a man looks on .;
4846324908.jpg| 3| Two young women discuss something while waiting .;
4846324908.jpg| 4| Three people are sitting on a wooden bench .;
4847636067.jpg| 0| A man in a blue hooded sweatshirt has his hands on the back spokes of his upside-down bike , as he sits on a low graffiti-covered wall among palm trees .;
4847636067.jpg| 1| A bike is flipped upside while someone , their identity obscured by a blue hoodie , works on the back tire .;
4847636067.jpg| 2| An individual in jeans and a hoodie is sitting outside while tinkering with his bicycle .;
4847636067.jpg| 3| Someone in a blue jeans and a blue hoodie covering their face , fixing a bike .;
4847636067.jpg| 4| a BMX rider sitting on a concrete ledge fixing his wheel , at the skate park .;
4852053268.jpg| 0| Three people sit on the edge of a marble pool filled with green water .;
4852053268.jpg| 1| Two young men are seated in front of a green pool of water .;
4852053268.jpg| 2| People are sitting on the edge of a large reflecting pond .;
4852053268.jpg| 3| A couple of guys sitting on the ledge of a man-made pond .;
4852053268.jpg| 4| Two men sitting on the edge of a pool of water .;
485296499.jpg| 0| Three elderly men look at books on display in a bookstore while a man and woman , both wearing white jackets , walk by .;
485296499.jpg| 1| A couple walks down an isles at a store selling art and history books .;
485296499.jpg| 2| Several people browse through books at a store with a tile floor .;
485296499.jpg| 3| The men are checking out magazines in a newsstand .;
485296499.jpg| 4| People looking at books in a store .;
4855045103.jpg| 0| A man in a white shirt playing an electric violin in front of a white brick wall .;
4855045103.jpg| 1| A man playing a violin like instrument advertising a coffee drink .;
4855045103.jpg| 2| A man playing a unique violin while looking up at the ceiling .;
4855045103.jpg| 3| A man playing a strange looking violin .;
4855045103.jpg| 4| a man playing an electric violin .;
4855691043.jpg| 0| Brown horse standing in the background while man in a white cowboy hat and blue long-sleeve shirt is walking off .;
4855691043.jpg| 1| The crowd watches the horse , staring at the cowboy as he leaves the arena , wondering what will happen next .;
4855691043.jpg| 2| Cowboy on foot in some enclosed area with a horse with spectators .;
4855691043.jpg| 3| A man dressed as a cowboy walks away from a brown horse .;
4855691043.jpg| 4| A man jumps off his horse at a rodeo .;
4857278444.jpg| 0| People walk through an Asian Market with red lanterns hanging from the rafters .;
4857278444.jpg| 1| An Asian marketplace is open for business at night .;
4857278444.jpg| 2| A group of people are walking down an alleyway .;
4857278444.jpg| 3| People shopping in an outdoor Asian market .;
4857278444.jpg| 4| a crowd of people on an asian style street .;
4860096411.jpg| 0| Passengers on public transportation listening to music through portable devices .;
4860096411.jpg| 1| A sumo wrestler rides the train while listening to headphones .;
4860096411.jpg| 2| A large man sitting on a bus wearing a purple and gray kimono .;
4860096411.jpg| 3| A man is sitting on a train listening to music .;
4860096411.jpg| 4| Man on the bus listening to headphones .;
4862041366.jpg| 0| A little girl with a flower on her swimsuit stands on a lake-beach while others frolic in the background .;
4862041366.jpg| 1| A little girl wearing a black swimming suit holding a shovel at a beach .;
4862041366.jpg| 2| A young girl in a swimsuit stands silently on a small beach .;
4862041366.jpg| 3| A little girl on the beach with a shovel in hand .;
4862041366.jpg| 4| Little girl standing in sand at the beach .;
486738076.jpg| 0| A middle-aged male wearing a baseball cap , a shirt inscribed orange county traders and white towel tucked under his belt and preparing a meal in hibachi style .;
486738076.jpg| 1| A man wearing an Orange County Traders t-shirt uses a spatula to turn chopped meat that 's smoking on a grill .;
486738076.jpg| 2| A man is cooking on an outdoor grill wearing clear plastic gloves with a white towel tucked into his belt .;
486738076.jpg| 3| A man in a blue shirt uses a spatula to stir food cooking on a grill .;
486738076.jpg| 4| A man cooking outside on a grill .;
4876342546.jpg| 0| A young lady wearing a turquoise colored bustier over a black shirt , a black skirt , netted tights , and laced up gloves is sitting next to five other young ladies , most of which are also dressed in black colored fitted clothing .;
4876342546.jpg| 1| A group of young girls dressed in mostly black are sitting .;
4876342546.jpg| 2| A group of nicely-dressed women are sitting together .;
4876342546.jpg| 3| A group of young women are sitting down outside .;
4876342546.jpg| 4| girls sitting with their hands on their laps;
4878089623.jpg| 0| Six men in tuxedos stand next to a black metal fence outside the back doors of a marble building .;
4878089623.jpg| 1| A group of young men dressed in formal attire are standing outside of a marble building .;
4878089623.jpg| 2| There is a group of young men huddled in a circle , seemingly singing .;
4878089623.jpg| 3| A black man in a tux surrounded by five other men behind a metal gate .;
4878089623.jpg| 4| Six formally-dressed black men stand at a railing near a fire exit .;
4878432074.jpg| 0| A man of perhaps Indian descent is standing in an outdoor market in front of a variety of produce .;
4878432074.jpg| 1| Man in red and white striped shirt points left while standing near a display of produce .;
4878432074.jpg| 2| A man stands in a market amongst vegetables and t-shirts pointing to his left .;
4878432074.jpg| 3| A man stands in front of a vegetable display .;
4878432074.jpg| 4| A man who appears to be buying vegetables .;
4879766314.jpg| 0| This picture appears to be of tourists pointing out the sights along the way from the sidewalk as some are pointing and most are carrying cameras .;
4879766314.jpg| 1| Groups of tourists walk across bridge while looking at views of old buildings .;
4879766314.jpg| 2| Small groups of people are walking over a bridge .;
4879766314.jpg| 3| Tourists walking across a crosswalk .;
4879766314.jpg| 4| People are walking over a bridge .;
4882632874.jpg| 0| A man is walking on a paved surface backdropped by a large art mural .;
4882632874.jpg| 1| A man walking in front of a colorful mural on a brick road .;
4882632874.jpg| 2| A man is walking down the street next to a colorful wall .;
4882632874.jpg| 3| A man walking in front of a colorful wall mural .;
4882632874.jpg| 4| A man is walking near a very colorful wall .;
488561307.jpg| 0| A group of individual adults collect around a bar and engage in conversation .;
488561307.jpg| 1| Several people are seen from above , talking in the dark .;
488561307.jpg| 2| Individuals are gathered in what appears to be a bar .;
488561307.jpg| 3| A group of people are talking to each other in a bar .;
488561307.jpg| 4| group of people drinking and talking in a bar .;
4888307519.jpg| 0| Many people are standing on the street and one young woman is wearing headphones and looking toward the camera .;
4888307519.jpg| 1| A young woman wearing a black tank top is listening to music on her MP3 player while standing in a crowd .;
4888307519.jpg| 2| An Asian woman standing in a crowded urban area listening to music .;
4888307519.jpg| 3| There is a sale going on at Target and all are going there .;
4888307519.jpg| 4| Asian people walking around the streets .;
489065557.jpg| 0| A person in swimming trunks who has used a rope swing to jump into a lake .;
489065557.jpg| 1| A boy wearing red swim trunks is swinging from a rope into the water .;
489065557.jpg| 2| The man is dropping from a swinging rope into a calm river .;
489065557.jpg| 3| A man has let go of the rope swing over the river .;
489065557.jpg| 4| A boy jumping from a rope into the water .;
4891059394.jpg| 0| A woman with long brown hair , sunglasses , white shirt , scarf and jeans with a bag on her right shoulder walking down a sidewalk .;
4891059394.jpg| 1| A woman wearing a brown scarf and sunglasses , walks through a shopping outlet .;
4891059394.jpg| 2| A person in sunglasses , a scarf , a shirt , and jeans is walking outside .;
4891059394.jpg| 3| Women in a white shirt with a scarf walking while texting on her phone .;
4891059394.jpg| 4| women in white shirt with scarf and sunglasses;
489448114.jpg| 0| Several small kids playing baseball are sitting on a bench jeering at each other , the child in the middle is wearing a red helmet , and all children have blue shirts and cleats  and two of them are holding bats .;
489448114.jpg| 1| A boy in his blue t-shirt with a red helmet makes faces to another boy sitting next to him as another boy touches his helmet .;
489448114.jpg| 2| A little boy with a red baseball hat on , is making a silly face at another player .;
489448114.jpg| 3| A group of young baseball players act silly while sitting on the bench .;
489448114.jpg| 4| A couple of kids sitting on a bench playing with a red helmet .;
4895398811.jpg| 1| A woman in black pants crosses a busy sidewalk in front of a gentlemen 's club .;
4895398811.jpg| 2| A man in black slacks leaves the New York Dolls Gentlemen 's ' Club .;
4895398811.jpg| 4| A man is exiting a gentleman 's club .;
489723654.jpg| 0| A man in an orange vest is on the sidewalk playing a guitar and singing while others are walking down the sidewalk .;
489723654.jpg| 1| A man in his own world of him and his music just entertaining on the street corner .;
489723654.jpg| 2| A man singing and playing guitar on a busy sidewalk .;
489723654.jpg| 3| A busker performs on guitar among a crowded street .;
489723654.jpg| 4| A musician on a busy street .;
4902022815.jpg| 0| In a laundry room , a man with a shaved head is looking intently in his laundry bag .;
4902022815.jpg| 1| Man in yellow shirt looking into his blue laundry bag , next to a washer .;
4902022815.jpg| 2| A man in a yellow shirt looks through a blue bag .;
4902022815.jpg| 3| This is a man that is about to do his laundry .;
4902022815.jpg| 4| A man in a yellow shirt looks in a blue bag .;
4903745980.jpg| 0| Several people sit at tables at an outdoor cafe with a black suited man in the foreground .;
4903745980.jpg| 1| A man in a business suit reads a book while a couple in a table nearby are conversing .;
4903745980.jpg| 2| People use their time in the city to relax in each others company .;
4903745980.jpg| 3| People are sitting at small tables outside .;
4903745980.jpg| 4| A gentleman sitting alone at a table .;
4912431886.jpg| 1| A man hanging from a rope washes the windows of a red brick building .;
4912431886.jpg| 2| A man is washing the windows of a brick building .;
4912431886.jpg| 3| A man washing windows on a red brick building .;
4912431886.jpg| 4| A window cleaner is repelling down a building .;
4913618585.jpg| 0| Little girl wearing a yellow shirt jumping over a orange cone .;
4913618585.jpg| 1| A young girl in a yellow shirt jumps over an orange cone .;
4913618585.jpg| 2| Child in a yellow shirt jumping over traffic cones .;
4913618585.jpg| 3| A young girl running through orange cones .;
4913618585.jpg| 4| Young girl playing with orange cone .;
4913618813.jpg| 0| A young girl appears to be jumping short , orange traffic cones on a grassy lawn while another young girl and an adult watch .;
4913618813.jpg| 1| A young girl in a yellow t-shirt and blue jeans is jumping over an orange cone .;
4913618813.jpg| 2| A little blond girl runs through orange cones .;
4913618813.jpg| 3| A young girl jumping over orange cones .;
4913618813.jpg| 4| A child jumping through some cones .;
4917929879.jpg| 0| A woman in a pink shirt and patterned skirt plays a violin beside a man wearing track pants and a black hat playing a black guitar on the street .;
4917929879.jpg| 1| A man in gray and black is playing a black acoustic guitar with a slightly shorter woman who is wearing pink and playing a violin .;
4917929879.jpg| 2| A woman is playing the violin and a man is playing the guitar while standing outside , performing for money .;
4917929879.jpg| 3| Two musicians are playing a tune together at a construction site .;
4917929879.jpg| 4| The man and woman play guitar and violin together .;
4920764215.jpg| 0| A man and a woman are walking in the rain , and the man is holding an umbrella over both he and his female companion .;
4920764215.jpg| 1| Many people walking down a busy street holding umbrellas in the rain .;
4920764215.jpg| 2| People are walking down a sidewalk in the rain with umbrellas .;
4920764215.jpg| 3| People with umbrellas walking past shops in the rain .;
4920764215.jpg| 4| People walking in the rain .;
49227122.jpg| 0| Several people are in a group where a man in a blue shirt is smiling .;
49227122.jpg| 1| people looking at expensive equipment and smiling;
49227122.jpg| 2| People are standing around outside an object .;
49227122.jpg| 3| Crowd looking at a camera , while smiling .;
49227122.jpg| 4| people are standing around smiling .;
492323406.jpg| 0| Three people , one of whom standing in back of the others , holding a can and dressed in red and white shirt that says help me , are cooking in a kitchen .;
492323406.jpg| 1| A man with orange balding hair wears a red leather jacket with white paint on it in a kitchen .;
492323406.jpg| 2| A man in a red jacket and bright yellow hair , watches his friend cooking .;
492323406.jpg| 3| Two men and one women are standing in front of a stove cooking .;
492323406.jpg| 4| Two people cooking in the kitchen as another person looks on .;
4923601195.jpg| 0| A man walking home after work at the construction site where an engineer had a conversation with his friend .;
4923601195.jpg| 1| A man carrying many things walking across a shadowy street with construction cones .;
4923601195.jpg| 2| A man carrying packages is walking through a freshly paved parking lot .;
4923601195.jpg| 3| Construction work on a road in the downtown area .;
4923601195.jpg| 4| A person is walking while carrying two objects .;
4924368758.jpg| 0| A Walgreens store is located at the corner of two streets .;
4924368758.jpg| 1| two people walking past a Walgreens located on a corner .;
4924368758.jpg| 2| A black car is about to cross Walgreens .;
4924368758.jpg| 3| A black car passes a Walgreens .;
4924368758.jpg| 4| Walgreens on a street corner .;
4926719517.jpg| 0| A man and a woman are walking away from bicycles while walking two brown dogs with shop buildings in the background .;
4926719517.jpg| 1| Someone wearing black shirt and shorts and another wearing gray top and jeans skirts are walking their dogs .;
4926719517.jpg| 2| A man and a woman wearing shorts walk two dogs on leashes along the sidewalk .;
4926719517.jpg| 3| Two people each walking a dog down the street .;
4926719517.jpg| 4| A couple are walking their dog .;
4927040237.jpg| 0| A young man wearing a red shirt , and blue jeans , is laying down next to a window .;
4927040237.jpg| 1| This young Asian man rests for a short while outside of an office building .;
4927040237.jpg| 2| A young man takes a nap in the window of a business next to the street .;
4927040237.jpg| 3| A man in a red shirt and jeans is lying down on a small ledge .;
4927040237.jpg| 4| A man takes a nap in the city .;
4928179041.jpg| 0| A glass blower uses a cylinder on the ground to shape a piece of glass he is blowing .;
4928179041.jpg| 1| A man in khaki colored shorts is blowing glass into a cylinder shaped container .;
4928179041.jpg| 2| Several casually dressed men prepare to work in a factory .;
4928179041.jpg| 3| A man is blowing water out of a pipe .;
4928179041.jpg| 4| A man prepares to blow glass .;
4928592495.jpg| 0| Two men , dressed in business suits , wearing long black coats , sharing a blue plaid umbrella , standing against a graffiti painted brick wall .;
4928592495.jpg| 1| Two young men in long jackets stand under an umbrella in front of a brick wall with graffiti .;
4928592495.jpg| 2| Two men in suits standing under an umbrella , next to a wall covered in graffiti .;
4928592495.jpg| 3| Two men in suits under an umbrella and in front of graffiti .;
4928592495.jpg| 4| two men in black holding an umbrella in the street .;
4930032075.jpg| 0| A group of people with painted faces are wearing costumes and are gathered together in front of an archway .;
4930032075.jpg| 1| Four clowns are performing outside while another clown plays the accordion .;
4930032075.jpg| 2| Five mimes with painted faces entertaining people at a renaissance fair .;
4930032075.jpg| 3| A group of people in clown makeup perform on the street .;
4930032075.jpg| 4| People are celebrating in a special way .;
4933973457.jpg| 0| A family of four that is near a canal where boats are going in and out of .;
4933973457.jpg| 1| A man and a woman in pink shirts snack with children .;
4933973457.jpg| 2| A family of four is standing and eating by a harbor .;
4933973457.jpg| 3| A family is standing outdoors on a cloudy day .;
4933973457.jpg| 4| A family standing on a dock eating snacks !;
4934343751.jpg| 0| A man with a blue shirt is looking over a railing with his hands at his sides and an orange hard hat in one hand .;
4934343751.jpg| 1| An older man with his hard hat in hand , standing and staring out at something .;
4934343751.jpg| 2| Construction worker stands looking over a rail while resting .;
4934343751.jpg| 3| A man in a blue shirt is holding a construction hat .;
4934343751.jpg| 4| The man in the blue looks very tired .;
49351137.jpg| 0| A young Asian man wearing a conical straw hat holding straw goods , and another person in the back to the left holding straw goods .;
49351137.jpg| 1| An Asian woman and sand at a marketplace with their good .;
49351137.jpg| 2| Two Asian vendors are selling straw wares in a market .;
49351137.jpg| 3| Townspeople in a downtown market selling goods .;
49351137.jpg| 4| A man is wearing a very strange hat .;
4937987953.jpg| 0| A woman in a field , wearing a short white dress and red shoes , is kicking up one of her heels .;
4937987953.jpg| 1| A woman posed in a field of grass wearing red shoes and a white dress .;
4937987953.jpg| 2| A blond woman in a white dress with red shoes standing in grass .;
4937987953.jpg| 3| A girl with a white dress is posing for the camera .;
4937987953.jpg| 4| A woman showing off her red shoes .;
4938457809.jpg| 0| Middle-aged man in jeans and dark blue t-shirt carrying a black item and walking across a lawn .;
4938457809.jpg| 1| A man in a dark shirt and glasses walks in grass while looking at something in his hands .;
4938457809.jpg| 2| The man ponders his situation during a stroll through the yard .;
4938457809.jpg| 3| A man with glasses walking looking at something in his hands .;
4938457809.jpg| 4| A man in a park holding a ball .;
4938863445.jpg| 0| A man in sunglasses wearing short shorts and knee pads jogging on the side of the street .;
4938863445.jpg| 1| An Asian man in short shorts and knee pads jogs down the street .;
4938863445.jpg| 2| A man wearing sunglasses , kneepads and shorts is jogging .;
4938863445.jpg| 3| Tanned Asian man in jean shorts jogs down a street .;
4938863445.jpg| 4| Man jogging on a city street .;
