2705298070.jpg| 1| two man practicing kung fu fighting while their trainer watches .;
2705298070.jpg| 2| Two sports men are playing a game before many viewers .;
2705298070.jpg| 3| two men involved in a mixed martial arts competition .;
2705298070.jpg| 4| Men sparing with each other at a gym .;
2708634088.jpg| 0| Two large black and brown dogs run through the tall grass .;
2708634088.jpg| 1| Two dogs are running side by side through long grass .;
2708634088.jpg| 2| two brown dogs one with a stick in its mouth;
2708634088.jpg| 3| Two tall black dogs run through tall grass .;
2708634088.jpg| 4| Two large dogs bound through a field .;
2716104559.jpg| 0| A crowd gathers around a docked white boat , equipped with orange life saver , along a riverbank and seaside landscape .;
2716104559.jpg| 1| A group of people are disembarking from a boat at a harbor on a bright sunny day .;
2716104559.jpg| 2| People stand on boat dock waiting for their boat to arrive .;
2716104559.jpg| 3| a crowd next to a lake on a port next to a boat;
2716104559.jpg| 4| Many people stand on a dock near a boat .;
2727051596.jpg| 0| The young boy in the orange shirt is sticking his tongue out while riding a ride .;
2727051596.jpg| 1| Two little boys playing a game , one with his mouth wide open .;
2727051596.jpg| 2| The two children are on an amusement park ride .;
2727051596.jpg| 3| Two boys enjoy a ride at an amusement park .;
2727051596.jpg| 4| Two little boys ride in a fairground ride .;
2728486640.jpg| 0| A white dog , with a black collar , opens its mouth wide while in front of a white building .;
2728486640.jpg| 1| A white dog catching a milkbone in his mouth;
2728486640.jpg| 2| A white dog catching a treat in his mouth .;
2728486640.jpg| 3| A dog catching a biscuit in its mouth .;
2728486640.jpg| 4| A white dog is jumping for a treat;
2734219983.jpg| 0| a woman in a colorful sari walks with a small boy who is carrying an umbrella through a busy city in the pouring rain .;
2734219983.jpg| 1| A woman and child with an umbrella walk through the street in the pouring rain .;
2734219983.jpg| 2| A woman in a sari next to a boy holding a red umbrella in a rainy street;
2734219983.jpg| 3| The lady and child walk to school in the rain .;
2734219983.jpg| 4| A woman walking in the rain with a child .;
2740762106.jpg| 0| A few people standing outside of a mountain with robes on glaring towards the mountain and initiating in some sort of ritual .;
2740762106.jpg| 1| A group of asian boys standing in front of a large mountain with there backs towards the camera .;
2740762106.jpg| 2| Several young people looking over a scenic point in a mountainous region .;
2740762106.jpg| 3| Asian people standing on a road beside a snowy mountain .;
2740762106.jpg| 4| A group of people getting ready for climbing a mountain .;
2742801792.jpg| 0| A man playing volleyball on a beach on a beautiful sunny day .;
2742801792.jpg| 1| A man awaits a descending volleyball on the beach court .;
2742801792.jpg| 2| A man is about to pass a volleyball on a beach court .;
2742801792.jpg| 3| Man in board shorts is playing beach volleyball .;
2742801792.jpg| 4| One guy playing volleyball on a beach .;
2745487323.jpg| 0| A man plays the piano , while a second man plays a guitar and a third man plays the saxophone .;
2745487323.jpg| 1| Three older men , wearing white shirts are playing music .;
2745487323.jpg| 2| Three older men playing live music in a grand hall .;
2745487323.jpg| 3| Three old guys playing some instruments .;
2745487323.jpg| 4| A formal band performing their works .;
2750577976.jpg| 0| Several women wearing white shoes and sandals walk through a street festival .;
2750577976.jpg| 1| Female friends are walking down the street , one of them smoking a cigarette .;
2750577976.jpg| 2| a group of girls walking through a street fair;
2750577976.jpg| 3| Two women walk down a busy street together .;
2750577976.jpg| 4| Three women are walking together .;
2759089516.jpg| 0| A child wearing gray shorts and pink-bottomed sneakers crawls through a window .;
2759089516.jpg| 1| A child wearing pink soled sneakers is climbing headfirst through a window .;
2759089516.jpg| 2| A child attempts to enter a house through the doggy door .;
2759089516.jpg| 3| a child 's legs while squeezing through a dog door .;
2759089516.jpg| 4| A kid climbs through a small door .;
2764057744.jpg| 0| Three people are gathered around a pit which has skinned animals on sticks that they are cooking .;
2764057744.jpg| 1| A woman in a gray sweater stands behind a row of roasted pigs on sticks .;
2764057744.jpg| 2| Three women sit around a raised fire pit cooking skewered young pigs .;
2764057744.jpg| 3| Two men and a woman up against a brick wall selling pig figurines .;
2764057744.jpg| 4| Asian market with pigs roasting over a pit .;
2764178773.jpg| 0| a man is performing an aerial jump on a bicycle in front of a mountain covered with pine trees .;
2764178773.jpg| 1| A person is holding onto a bicycle in the air with his body in flight position .;
2764178773.jpg| 2| A bike rider is doing a stunt on a bicycle over a forest .;
2764178773.jpg| 3| A man is attempting a stunt with a bicycle .;
2764178773.jpg| 4| A man doing a bicycle trick .;
2765815424.jpg| 0| A crowd is walking across the street at a busy intersection with many cars and many advertisements .;
2765815424.jpg| 1| Time lapse of many people crossing a street in front of a large group of billboards .;
2765815424.jpg| 2| Blurred time exposure of pedestrians crossing street .;
2765815424.jpg| 3| There is a busy street , with many people crossing .;
2765815424.jpg| 4| A group of people are crossing a busy street .;
2774890118.jpg| 0| Eleven people are running through white sand while the sun is soon to set in the background .;
2774890118.jpg| 1| A group of young children in many bright colors run along the sand .;
2774890118.jpg| 2| Several children running across a field of white sand .;
2774890118.jpg| 3| A group of people running on a beach at dawn .;
2774890118.jpg| 4| A group of people are running on the sand .;
278002947.jpg| 0| A boy with a Mohawk is wearing a navy blue sweatshirt in a crowd of people .;
278002947.jpg| 1| A man with a Mohawk hairstyle wears a backpack at a college campus .;
278002947.jpg| 2| A man with a Mohawk stands in a group of people .;
278002947.jpg| 3| A man with a Mohawk walking on campus .;
278002947.jpg| 4| The man has a Mohawk .;
2797774642.jpg| 0| images are missing images are missing images are missing images are missing images are missing images are missing;
2797774642.jpg| 1| Yellow team vs Red team kicking a blue & white soccer ball .;
2797774642.jpg| 2| Young boys in yellow and red uniforms are playing soccer .;
2797774642.jpg| 3| Children of opposing teams playing a game of soccer;
2797774642.jpg| 4| Children playing soccer on a field .;
2806694193.jpg| 0| Two young girls , one is wearing a striped shirt and the other one is wearing a yellow shirt , are leaping off a concrete retention wall .;
2806694193.jpg| 1| Two young girls jump off or over a concrete barrier in an inner city park .;
2806694193.jpg| 2| Two young people are jumping off of a concrete ledge on to the sidewalk .;
2806694193.jpg| 3| Young girls jumping off a cement wall with their arms in the air .;
2806694193.jpg| 4| two girls jumping on top of a concrete barrier .;
2817847072.jpg| 0| A boy in a soccer uniform running in a field during a game .;
2817847072.jpg| 1| A boy in green and white looks alert during a soccer game .;
2817847072.jpg| 2| A boy in a soccer uniform running on a field;
2817847072.jpg| 3| A soccer player is running on the field;
2817847072.jpg| 4| A soccer player running on the field .;
2824153131.jpg| 0| A woman rides the escalator , leaning on the railing , with many other people , and a crowded mall spreads out behind them .;
2824153131.jpg| 1| A man and a woman enjoy conversation as they ascend on a busy elevator .;
2824153131.jpg| 2| A young couple uses an escalator at a busy shopping center .;
2824153131.jpg| 3| There are several people going up the escalator .;
2824153131.jpg| 4| People going up an escalator in the mall .;
2826701936.jpg| 0| Children are playing in a puddle of water that has resulted from a spray gushing from the pavement .;
2826701936.jpg| 1| Kids wearing shorts playing outside in the park with sprinkling water .;
2826701936.jpg| 2| Children playing in water on a sunny day .;
2826701936.jpg| 3| A group of children playing in water .;
2826701936.jpg| 4| Children having fun getting wet .;
2827964381.jpg| 0| Two dogs wrestle in the grass with a chain link fence in the background .;
2827964381.jpg| 1| Two dogs are jumping up at each other in a grassy field .;
2827964381.jpg| 2| Two dogs on their hind legs leaning against each other .;
2827964381.jpg| 3| Two brown and black dogs wrestle in the long grass .;
2827964381.jpg| 4| Two dogs jumping on each other .;
2832978253.jpg| 0| A person in a white and red shirt and green backpack hiking on a mountain .;
2832978253.jpg| 1| A hiker climbing a rocky hill with fog surrounding him .;
2832978253.jpg| 2| A person wearing red and white climbs a foggy mountain .;
2832978253.jpg| 3| A hiker with a backpack is up on a misty mountaintop .;
2832978253.jpg| 4| A hiker walks on a mountainside .;
2833172038.jpg| 0| A man in a white t-shirt is holding the ten of clubs in his right hand near his head and the remaining cards in his left hand .;
2833172038.jpg| 1| A young man in glasses is drinking beer and holding the 10 of clubs to his forehead .;
2833172038.jpg| 2| A man who has been drinking beer is holding a card to his forehead .;
2833172038.jpg| 3| The man in the white shirt holds up a playing card .;
2833172038.jpg| 4| A man holds a card to his head .;
2849169944.jpg| 0| Three women in fedoras , dark brown shawls , and long brown skirts stand on a brick walkway with a seated dog .;
2849169944.jpg| 1| Three women in dark shawls and hats talk on a brick street while a dog sits next to them .;
2849169944.jpg| 2| Three women wearing robes and hats stand in a street with a yellow dog .;
2849169944.jpg| 3| Three women in old-fashioned clothing stand in the street with a dog .;
2849169944.jpg| 4| A group of women and a dog are discussing amongst each other;
2849842834.jpg| 0| Five women in dresses standing in a lobby talking .;
2849842834.jpg| 1| A group of women wearing kimono 's talk together .;
2849842834.jpg| 2| A group of Asian women are talking in an airport .;
2849842834.jpg| 3| A group of older asian women talking .;
2849842834.jpg| 4| Ladies talking in an airport .;
2855667597.jpg| 0| The four large , black dogs are running on the grass .;
2855667597.jpg| 1| Four black dogs run together on bright green grass .;
2855667597.jpg| 2| Four black dogs run across the grass .;
2855667597.jpg| 3| Four black dogs running over grass .;
2855667597.jpg| 4| Four dogs run on field;
2867459095.jpg| 0| A bald man in front of a microphone plays electric guitar under a spotlight .;
2867459095.jpg| 1| A man is holding a guitar with a light shining behind him .;
2867459095.jpg| 2| A male musician is playing guitar for a show on stage .;
2867459095.jpg| 3| A man plays his red guitar under the spotlight .;
2867459095.jpg| 4| This man is playing an electric guitar .;
2877313756.jpg| 0| A man and woman are looking over a brick wall at a beach scene with a man and a woman embracing at the bottom of the wall .;
2877313756.jpg| 1| Two couples are passionately embracing on a beach , while an elderly couple looks on from above .;
2877313756.jpg| 2| One couple is kissing against a wall while another looks on from atop the wall .;
2877313756.jpg| 3| An older couple looking down on a younger couple as they make love .;
2877313756.jpg| 4| Two people hugging while two other people stare down on them .;
288025239.jpg| 0| A woman smiles from inside a red tent that is surrounded by snow .;
288025239.jpg| 1| The hiker pokes out of her tent to find that snow is everywhere .;
288025239.jpg| 2| A person peeks out from a colorful tent in a vast field of snow .;
288025239.jpg| 3| A man pokes his head out of the red tent in the snow .;
288025239.jpg| 4| A person poses inside of a tent surrounded by snow .;
2888386138.jpg| 0| A child in a blue and white striped shirt crosses his arms and smiles while standing on red carpeted stairs .;
2888386138.jpg| 1| A child is standing beside a banister on a red carpeted stair .;
2888386138.jpg| 2| A boy is standing on the stairs with his arms folded .;
2888386138.jpg| 3| a young blond boy smiling standing on a staircase;
2888386138.jpg| 4| Little boy smiling on the stairs .;
289939071.jpg| 0| A couple is sitting along side a canal and kissing , while a woman in red sits near them and looks uncomfortable .;
289939071.jpg| 1| A casually dressed young blond woman is looking away sadly as couple near her are kissing .;
289939071.jpg| 2| Couple kisses while sitting on a bench next to a river while others are seated adjacent .;
289939071.jpg| 3| A blond woman in a red top is sitting on a wall next to a kissing couple in jeans .;
289939071.jpg| 4| The couple is kissing and lady in red turning her back .;
290019324.jpg| 0| A black and white dog with a spotted face is running through a dirt field .;
290019324.jpg| 1| The black and white dog trots through the dirt .;
290019324.jpg| 2| A white and black dog is running over dirt .;
290019324.jpg| 3| a dog runs across the ground .;
290019324.jpg| 4| A dog is running .;
2908859957.jpg| 0| The little girl in the yellow dress is jumping over a red and green rope .;
2908859957.jpg| 1| A girl wearing yellow jumps over a red and green rope .;
2908859957.jpg| 2| A little girl in a yellow dress jumping rope .;
2908859957.jpg| 3| A girl in a yellow dress jump ropes .;
2908859957.jpg| 4| A girl skips rope .;
2909811789.jpg| 0| A young boy is in the air after turning a trick on his bike on a pyramid ramp .;
2909811789.jpg| 1| Young man on a trick bicycle jumping off a masonry pyramid .;
2909811789.jpg| 2| A bicycle stunt jump is being perforced in a city .;
2909811789.jpg| 3| A bicyclist is jumping on a pyramid-shaped ramp .;
2909811789.jpg| 4| A Man is jumping his bicycle over a pyramid .;
2917463531.jpg| 0| The sailor wearing his white uniform and cap with his arms folded a standing in front of the ship as two man with blue coats are talking;
2917463531.jpg| 1| At a naval yard , a man in a white Navy officer 's uniform is standing by two older men having a discussion .;
2917463531.jpg| 2| A sailor stands at the entrance of a historical wooden shop talking to two men .;
2917463531.jpg| 3| Sailors stand at the top of a gangplank to a large boat .;
2917463531.jpg| 4| A group of seamen talking in front of a boat .;
2922981282.jpg| 0| A young man and woman lay on a bed , the woman makes a goofy face .;
2922981282.jpg| 1| Two young people are lying on a bed together .;
2922981282.jpg| 2| Interracial couple in bed making faces;
2922981282.jpg| 3| a young couple lying on a bed together;
2922981282.jpg| 4| A young couple lying in bed .;
2926786902.jpg| 0| A skiing man in a fluorescent jacket jumps very high and it looks as though he is flying .;
2926786902.jpg| 1| The skier in the green jacket and white pants appears to almost fly into the sky .;
2926786902.jpg| 2| A skier in a yellow jacket is airborne above the mountains .;
2926786902.jpg| 3| A skier jumps high in the air with a view of the mountains .;
2926786902.jpg| 4| Somone is high in the air doing a ski jump .;
293151893.jpg| 0| Two dogs are silhouette as they chase each other along the water .;
293151893.jpg| 1| A silhouette of one dog chasing another dog .;
293151893.jpg| 2| A silhouette of two dogs running by a lake .;
293151893.jpg| 3| Two dogs running on land along the water .;
293151893.jpg| 4| Two dogs running on the shore .;
2934801096.jpg| 2| Two males on a street corner crooswalk with a billboard behind them .;
2934801096.jpg| 4| Two males stand by a board that says HELL .;
2937365149.jpg| 0| Young children in black uniforms perform a martial arts demonstration with sticks in front of a crowd .;
2937365149.jpg| 1| Young students demonstrate their swordsmanship in front of onlookers .;
2937365149.jpg| 2| Boys and girls in black uniform holding bamboo sticks in a parade .;
2937365149.jpg| 3| Several children practicing martial arts with wooden swords;
2937365149.jpg| 4| A group of children doing karate .;
2938120171.jpg| 0| Two blond dogs are standing together on a patio .;
2938120171.jpg| 1| Two golden dogs are standing on a wooden patio .;
2938120171.jpg| 2| A large dog sniffing a smaller dog outside .;
2938120171.jpg| 3| Two dogs are standing together on a patio .;
2938120171.jpg| 4| Two golden dogs on a wood deck .;
2940522002.jpg| 0| A middle-aged blond woman wearing a black sleeveless top , white pants , and a frown stands at a transit stop .;
2940522002.jpg| 1| A white woman wearing white pants and a black top is waiting for the bus to come .;
2940522002.jpg| 2| A blond woman in a black shirt waits for the train .;
2940522002.jpg| 3| Unexpected photo op in the train station;
2940522002.jpg| 4| A woman is walking on a sidewalk .;
2943384009.jpg| 0| A black and white motorcycle is being ridden around a racetrack .;
2943384009.jpg| 1| A orange , white , and black motorcyclist racing .;
2943384009.jpg| 2| A man on a motorcycle is racing on a track .;
2943384009.jpg| 3| A motorcycle racer speeds down a track .;
2943384009.jpg| 4| A professional motor racer in motion .;
2949497756.jpg| 0| Two dogs are nose to nose while a third dog stands next to them .;
2949497756.jpg| 1| Three tan dogs are outside , one licks the other 's nose .;
2949497756.jpg| 2| Two dogs touching noses near another dog .;
2949497756.jpg| 3| Three brown dogs on the patchy grass .;
2949497756.jpg| 4| Two tan dogs smell each others faces .;
2951750234.jpg| 0| A person wearing a navy jacket and black hat jumping over a small partition on a horse .;
2951750234.jpg| 1| A show jumper is making a brown horse jump over a white fence .;
2951750234.jpg| 2| An equestrian and a horse are jumping over an obstacle .;
2951750234.jpg| 3| A jockey on a black horse jumps over a hurdle .;
2951750234.jpg| 4| A woman on a horse jumps an obstacle .;
2954840987.jpg| 0| A couple is getting married in a church with a vaulted wooden ceiling .;
2954840987.jpg| 1| A wedding that is being held in a beautiful wooden church .;
2954840987.jpg| 2| A wedding in a church with wooden cathedral ceilings .;
2954840987.jpg| 3| A couple getting married in a church before guests .;
2954840987.jpg| 4| A couple is married in a church as guests look on .;
2957763153.jpg| 0| A man in a small bathing suit talks to another man on the beach in front of a beach patrol stand .;
2957763153.jpg| 1| A beach patrol station on the beach in front of the ocean with a man in a bathing suit .;
2957763153.jpg| 2| A group of lifeguards sit together in highchairs along side the shoreline of a beach .;
2957763153.jpg| 3| Lifeguards gather at the Beach Patrol station .;
2957763153.jpg| 4| A beach patrol on the beach .;
296820758.jpg| 0| An asian woman is sitting on the floor inside holding a purse made from palm fronds .;
296820758.jpg| 1| A woman is sitting and holding a partially woven basket .;
296820758.jpg| 2| A woman sitting in the floor making a basket .;
296820758.jpg| 3| A woman weaving baskets made of grass .;
296820758.jpg| 4| Asian woman weaving with bamboo .;
2969193503.jpg| 0| A teenage boy wearing a white t-shirt and jeans is sitting on a yellow bench and putting on a pair of black shoes .;
2969193503.jpg| 1| A man in a nice apartment , sitting while putting his right shoe on next to his standing friend .;
2969193503.jpg| 2| A male in a white t-shirt and jeans sits down to put on his black shoes .;
2969193503.jpg| 3| A young man sits on a chair with one shoe off .;
2969193503.jpg| 4| A skinny man is about to put on his shoe .;
2975118353.jpg| 0| A snowboarder launches into the air over white snow;
2975118353.jpg| 1| A man is performing a jump on his snowboard .;
2975118353.jpg| 2| A snowboarder glides through the air .;
2975118353.jpg| 3| a snowboarder jumps into the air .;
2975118353.jpg| 4| A snowboarder suspended in the air;
297535592.jpg| 1| A rock band plays on a Zune stage while many people watch .;
297535592.jpg| 2| A band playing from the point of view of the audience .;
297535592.jpg| 3| A crown of people watching a band play on a stage .;
297535592.jpg| 4| People attending a outdoor concert .;
2976350388.jpg| 0| The man is jumping through the air , while holding a bicycle .;
2976350388.jpg| 1| A cyclist carries his bicycle while jumping over a hurdle .;
2976350388.jpg| 2| A bicycler jumping over a barrier with his bike .;
2976350388.jpg| 3| a man jumps across an obstacle carrying his bike;
2976350388.jpg| 4| A man doing tricks with his bicycle .;
2977246776.jpg| 0| A small child shows excitement on a swing set at the park;
2977246776.jpg| 1| The girl is being pushed on the swing by the woman .;
2977246776.jpg| 2| A little girl swings , a woman stands behind her .;
2977246776.jpg| 3| a mom pushes her little girl on the swing .;
2977246776.jpg| 4| Woman stands behind young girl on swing set;
2979998405.jpg| 0| A group of children in costumes are on a stage with red curtains .;
2979998405.jpg| 1| A group of people with children are performing on a stage .;
2979998405.jpg| 2| A group of adults and children dressed up and dancing .;
2979998405.jpg| 3| Children are preparing for a play on stage .;
2979998405.jpg| 4| adults in costumes with children on a stage;
2992226950.jpg| 0| A man on a bicycle rides down a small street as a truck drives behind him .;
2992226950.jpg| 1| A poor looking man in a blue shirt is riding a bicycle slowly .;
2992226950.jpg| 2| A green pull wagon is parked under a tree in a shaded area .;
2992226950.jpg| 3| A man bicycling through a street , followed by a truck .;
2992226950.jpg| 4| A man riding a bicycle down the street .;
2992808092.jpg| 0| Two opposing male players are chasing the ball in field hockey .;
2992808092.jpg| 1| Two hockey players are trying to shoot the puck on the grass .;
2992808092.jpg| 2| Two teenagers participate in a game of field hockey .;
2992808092.jpg| 3| two field hockey players fight for the ball .;
2992808092.jpg| 4| Two boys fight for the ball .;
299303069.jpg| 0| A child in a orange shirt is pouring Legos out of a plastic bag .;
299303069.jpg| 1| A child is spilling a set of Legos out of a bag onto a table .;
299303069.jpg| 2| A young boy is dumping a bag of Lego 's onto a glass table .;
299303069.jpg| 3| A boy in an orange shirt is pouring Legos from a bag .;
299303069.jpg| 4| Young boy playing with Legos .;
2999638340.jpg| 0| A brown dog lays in the snow while posing for a picture .;
2999638340.jpg| 1| A brown dog is laying in the snow .;
2999638340.jpg| 2| A brown dog playing in the snow .;
2999638340.jpg| 3| a tan dog is sitting in some snow;
2999638340.jpg| 4| A brown dog is laying on snow .;
3003691049.jpg| 0| A little girl is playing with a large , white poodle in the driveway next to a police car .;
3003691049.jpg| 1| A large white dog , a girl , and a police car in a driveway and an SUV in a garage .;
3003691049.jpg| 2| A dog corners a little girl next to a police cruiser .;
3003691049.jpg| 3| The girl is playing with her dog in her driveway .;
3003691049.jpg| 4| A girl playing with a dog near a police car .;
3005135868.jpg| 0| A woman with shoulder-length brown hair is straddling a ledge .;
3005135868.jpg| 1| A woman straddling a wall , while reading a book .;
3005135868.jpg| 2| A woman sitting on a wall on a bright summer day .;
3005135868.jpg| 3| woman sitting on a tall , white wall .;
3005135868.jpg| 4| A woman is straddling a wall .;
3005512395.jpg| 0| A young male child , wearing khaki pants and a red striped polo shirt , sitting on a steel slide in a public playground .;
3005512395.jpg| 1| A young boy , sitting on a slide at the playground , poses for a picture .;
3005512395.jpg| 2| A young boy with a striped red shirt smiling at the bottom of a slide .;
3005512395.jpg| 3| A toddler is sitting at the bottom of a slide and smiling .;
3005512395.jpg| 4| Young boy is sitting on a playground slide .;
3014609505.jpg| 0| Four men in blue soccer uniforms on a soccer field , where one is holding a ball and listening to a man in a black outfit .;
3014609505.jpg| 1| Four players on a soccer team stand on a field while one of them holds the yellow ball and talks to the referee .;
3014609505.jpg| 2| Soccer players out on the field dressed in blue getting cues from the ref dressed in black .;
3014609505.jpg| 3| A soccer referee points as he directs a soccer player in blue during a soccer game .;
3014609505.jpg| 4| A referee pointing while a soccer player looks on .;
3016510194.jpg| 0| A group of friends huddle together at their local bar to take a memorable picture .;
3016510194.jpg| 1| Five women and two me come together for a photo in a bar .;
3016510194.jpg| 2| A group of seven people posing for a picture in a bar .;
3016510194.jpg| 3| A group of young individuals posing for a picture .;
3016510194.jpg| 4| A group of friends is posing in a pub .;
3018467501.jpg| 0| Several young girls playing on a trampoline with a blue covering .;
3018467501.jpg| 1| A group of little girls jumping together in a backyard .;
3018467501.jpg| 2| Young girls play together with glee and joy .;
3018467501.jpg| 3| Three girls jumping on a trampoline .;
3018467501.jpg| 4| Three girls happily jumping .;
3019609769.jpg| 0| A small group of black adults and children are walking on a brown surface .;
3019609769.jpg| 1| A group of people are walking down a road passing by some barb-wire .;
3019609769.jpg| 2| A poor family is leaving their home with only a few belongings .;
3019609769.jpg| 3| A group of people carrying bags walk near a barb wire fence .;
